_link_txt,category,combined_text,country,curation_before_similarity,dedupe_reason,duplicate_of,is_trump_story,key_toks_title,lang,lang_conf,lang_detected,lang_method,link,most_debated_score,most_debated_score_raw,published_iso,reddit_match_count,reddit_matches,secondary_category,secondary_category_hint,shortlist_score,sim_cluster_id,sim_is_dupe,sim_score,sim_title_ratio,sim_to_index,source_method,source_name,source_url,summary,title,trump_exempt
,Underholdning,,,-50.5721725209332,,,,,,0.9999999501049376,no,agree,https://www.nrk.no/sport/,,,2012-12-31T18:35:26+00:00,,,,Økonomi,0.9475178835386954,182,False,,,,html-enriched,NRK – Toppsaker,https://www.nrk.no/,"Resultatservice, nyheter, videoer og sendeplan for sport i radio og TV. Oppdater deg på sportsnyheter fra inn- og utland på NRK Sport.","NRK Sport – Sportsnyheter, resultater og sendeplan",
,Underholdning,,CH,-53.65331591201528,,,,,en,0.9999969610177492,en,agree,https://lenews.ch/2025/10/03/film-it-was-just-an-accident-1-2/,,,2025-10-03T17:10:50+00:00,,,,Økonomi,1.5095041625984305,190,False,,,,html-enriched,"Le News (Switzerland, EN)",https://lenews.ch/,3 October 2025 UN SIMPLE ACCIDENT ***1/2 (vo Farsi) Iranian director Jafar Panahi’s latest prize-winning film (Palme d’Or winner at Cannes 2025) is one of his most openly anti-governmental works,FILM: IT WAS JUST AN ACCIDENT ***1/2,
,Underholdning,,MC,-64.94598510765051,,,,,en,1.0,en,langid_confident,https://www.monaco-tribune.com/it/2025/10/kelly-rutherford-da-hollywood-a-monaco-lincredibile-battaglia-di-una-madre-per-i-suoi-figli/,,,2025-10-03T09:30:08+00:00,,,,Økonomi,1.6494994335206967,215,False,,,,html-enriched,Monaco Tribune (EN),https://www.monaco-tribune.com/en/,"La star della serie di successo Gossip Girl si è ritrovata suo malgrado, per anni, al centro di un'estenuante battaglia giudiziaria per la custodia dei","Kelly Rutherford: da Hollywood a Monaco, l’incredibile battaglia di una madre per i suoi figli",
,Underholdning,,DK,-69.9144764353263,,,,,da,0.9999999996900932,da,agree,https://nyheder.tv2.dk/live/udland/2025-06-27-afgoerelsen-i-diddy-sagen,,,2025-06-27T13:11:04.917000+00:00,,,,Økonomi,1.315841717004926,230,False,,,,html-enriched,TV 2 Nyheder (DA),https://nyheder.tv2.dk/,"Hvad sker der? Den amerikanske musiker Sean 'Diddy' Combs er fredag blevet idÃ¸mt lidt over fire Ã¥rs fÃ¦ngsel, efter at han ved en opsigtsvÃ¦kkende retssag i New...",AfgÃ¸relsen i Diddy-sagen - TV 2,
,Underholdning,,LU,-87.14475099390857,,,,,en,0.9999999989467268,en,agree,https://www.luxtimes.lu/culture/usual-suspects-and-new-faces-shortlisted-for-luxembourg-film-awards/94339900.html,,,2025-10-01T13:48:06.000Z,,,,Økonomi,1.2842304212218052,263,False,,,,html,Luxembourg Times (EN),https://www.luxtimes.lu/,The Grand Duchy’s equivalent to the Oscars or Baftas will be awarded in November after voting by members of the Luxembourg Filmakademie,Usual suspects and new faces shortlisted for Luxembourg film awards,
,Underholdning,,AT,-97.8692930801609,,,,,en,0.999999755759636,en,agree,https://apnews.com/video/meet-huntrx-the-singers-that-power-kpop-demon-hunters-ap-interview-00000199a2e7dce9abdfeaf7cc4d0000,,,2025-10-02T03:12:31.409Z,,,,Økonomi,1.134440307175929,284,False,,,,sitemap,AP News – Austria hub,https://apnews.com/hub/austria,"""We're gonna bask in it now."" The breakout singing voices behind Netflix’s hit ""KPop Demon Hunters"" — Rei Ami, EJAE, and Audrey Nuna (a.k.a.",Meet HUNTR/X: The singers that power 'Kpop Demon Hunters' | AP interview,
,Underholdning,,EU,-150.32141819782558,,,,,en,0.9999954827761663,en,agree,https://www.euronews.com/video/2025/10/04/latest-news-bulletin-october-4th-2025-morning,,,2025-10-04T05:00:33+00:00,,,Økonomi,Økonomi,1.8393073073425124,365,False,,,,html-enriched,Euronews (EN),https://www.euronews.com/,"Video. Catch up with the most important stories from around Europe and beyond this October 4th, 2025 - latest news, breaking news, World, Business, Entertainment, Politics, Culture, Travel.","Video. Latest news bulletin | October 4th, 2025 – Morning | Euronews",
,Utenriks,,PL,0.9,,,,,en,1.0,en,agree,"https://www.polskieradio.pl/395/7791/artykul/3587759,focus-behind-the-scenes-of-the-chopin-piano-competition",,,,,,,Økonomi,2.175,6,False,,,,html-enriched,Polskie Radio – English,"https://www.polskieradio.pl/395,english-section","Eighty-four pianists from twenty countries are competing in the 19th International Chopin Piano Competition, which started in Warsaw in October 2. In 2015 among those competitors was 16-year-old Tony Yang who won the fifth prize and remains the youngest winner of it to this date. I caught up with him to get a sneak peek behind-the-scenes of his journey into the decisive moments of the competition. We discussed intense pressure and anxiety, friendships, picking the instrument, rituals and much, much more!",FOCUS :: Behind the Scenes of the Chopin Piano Competition - English Section,
,Utenriks,,CH,-7.6074622375978596,,,,,en,0.9999975622484312,en,agree,https://www.swissinfo.ch/eng/inside-geneva-podcast/,,,2025-02-18T08:54:52+00:00,,,,Økonomi,1.2703652057008266,50,False,,,,html-enriched,SWI swissinfo.ch (EN),https://www.swissinfo.ch/eng/,Stay informed with Inside Geneva podcast. Get straight talk on global politics and humanitarian issues from host Imogen Foulkes.,Inside Geneva Podcast - SWI swissinfo.ch,
,Utenriks,,SE,-9.405464367343674,,,,,sv,1.0,sv,agree,https://omni.se/kallor-netanyahu-godkande-attack-mot-konvoj-i-tunisien/a/93ylyE,,,2025-10-04T03:44:46+00:00,,,,Økonomi,1.751023284875731,57,False,,,,html-enriched,Omni (SE),https://omni.se/,Israels premiärminister Benjamin Netanyahu gav landets militär grönt ljus att attackera aktivistkonvojen Global Sumud Flotilla i Tunisien. Det uppger två amerikanska underrättelsekällor för CBS News.,Källor: Netanyahu godkände attack mot konvoj i Tunisien,
,Utenriks,,FR,-18.9369673622666,,,,,en,0.999996810488297,en,agree,https://mondediplo.com/foreign-editions,,,2001-12-01T00:00:00+00:00,,,,Økonomi,1.371259569136234,92,False,,,,html-enriched,Le Monde diplomatique (EN),https://mondediplo.com/,"Open access // (Le Monde diplomatique - English edition, December 0001)","International editions (Le Monde diplomatique - English edition, December 0001)",
,Utenriks,,FI,-26.581874983110403,,,,,en,0.9999999973222244,en,agree,https://www.dailyfinland.fi/worldwide/45541/Israeli-navy-takes-over-last-boat-of-Gaza-bound-aid-flotilla,,,,,,,Økonomi,1.39,118,False,,,,html-enriched,Daily Finland (EN),https://www.dailyfinland.fi/,"The Israeli navy intercepted the last vessel of the Gaza-bound Global Sumud Flotilla (GSF) in the Mediterranean Sea on Friday,",Israeli navy takes over last boat of Gaza-bound aid flotilla,
,Utenriks,,MC,-34.491260519928844,,,,,en,0.9999958881055856,en,agree,https://news.mc/2025/09/29/prince-albert-ii-attends-historic-cycling-world-championships-in-kigali/,,,2025-09-29T11:52:44+00:00,,,,Økonomi,1.3939742841500384,140,False,,,,html-enriched,NEWS.MC – Monaco (EN),https://news.mc/,Prince Albert II attends historic Cycling World Championships in Kigali,Prince Albert II attends historic Cycling World Championships in Kigali - NEWS.MC - Monaco News,
,Utenriks,,GR,-62.364896332570645,,,,,en,0.9999999997444186,en,agree,https://www.ekathimerini.com/news/1237976/greeces-press-freedom-index-improves-still-ranks-last-in-eu/,,,2024-05-03T00:00:00+00:00,,,,Økonomi,1.8826603941819309,210,False,,,,html-enriched,Kathimerini English Edition,https://www.ekathimerini.com/,"Greece’s press freedom index improved, rising 19 places in 2024, but remains last among EU countries. The country has risen to the 88th place from 107th last year out of 180 countries, in Reporters Without Borders’ (RSF) 2024 World Press Freedom, Index, released on Friday.","Greece’s press freedom index improves, still ranks last in EU | eKathimerini.com",
,Utenriks,,CZ,-93.65865638624966,,,,,en,0.9999999999942298,en,agree,https://praguemonitor.com/economy/20/11/2023/germany-seeks-skilled-workers-from-africa-with-focus-on-collaboration-and-return-plans/,,,2023-11-20T10:46:02+00:00,,,,Økonomi,1.5901218137111883,275,False,,,,html-enriched,Prague Monitor (EN),https://praguemonitor.com/,"Germany aims to attract skilled workers from Africa with the promise of a future, while simultaneously emphasizing the importance of smooth deportations for",Germany Seeks Skilled Workers From Africa With Focus On Collaboration And Return Plans - Prague Monitor,
,Utenriks,,LU,-118.58970379816218,,,,,en,0.99999999999996,en,agree,https://www.luxtimes.lu/luxembourg/snipers-and-silent-watchmen-behind-the-scenes-of-the-trounwiessel/95079431.html,,,2025-10-04T09:53:27.000Z,,,,Økonomi,1.81257749847161,319,False,,,,html,Luxembourg Times (EN),https://www.luxtimes.lu/,"With the eyes of the world on Luxembourg, a look at the work behind the scenes to keep all visitors and the public safe",Snipers and silent watchmen: behind the scenes of the ‘Trounwiessel’,
,Utenriks,,DE,-158.5618883406948,,,,,en,0.9999999999999994,en,agree,https://www.tagesspiegel.de/berlin/berlin-senate-drafts-a-catalogue-of-fines-4156366.html,,,2020-03-31T07:47:45.000Z,,,,Økonomi,1.442541392883459,377,False,,,,html,Tagesspiegel – In English,https://www.tagesspiegel.de/kultur/themen/in-english,"Since the shutdown began, cases of domestic violence have increased in the city. Refugees from Lesbos may be brought to Berlin. And this is how the world reacts to the pandemic.",Fines of up to 500 Euros for Violations: Berlin Senate Drafts a Catalogue of Fines,
,Utenriks,,UA,-162.41115933067536,,,,,en,0.9999965313130168,en,agree,https://kyivindependent.com/tag/eastern-europe/,,,2025-09-29T18:37:30+00:00,,,,Økonomi,1.3349436023162242,383,False,,,,html-enriched,Kyiv Independent (EN),https://kyivindependent.com/,"News, analyses, investigations, opinions, podcasts and more. On-the-ground reporting from Ukraine",Eastern Europe — The Kyiv Independent - The Kyiv Independent,
,Utenriks,,IE,-166.4260916692815,,,,,en,0.9999999995600546,en,agree,https://www.irishexaminer.com//sport-columnists/arid-41717577.html,,,2025-10-04T06:46:00+01:00,,,,Økonomi,1.4361857339257706,389,False,,,,html,Irish Examiner,https://www.irishexaminer.com/,"At the recent World Athletics Championships, I thought this would be a hot topic. I thought wrong.",Cathal Dennehy: Why has athletics run away from the Israel question?,
,Utenriks,,EE,-244.4541068065174,,,,,en,0.9999999996156888,en,agree,https://estonianworld.com/author/sergey-maidukov/,,,2025-09-14T00:00:00+00:00,,,,Økonomi,1.4328044906097102,474,False,,,,html-enriched,Estonian World (EN),https://estonianworld.com/,"Europe has celebrated its Shakespeares and Mozarts, but Ukraine’s Shevchenko, Malevich and Skovoroda remain largely unknown – erased by centuries of Russian repression. From Shakespeare […]","Sergey Maidukov, Author at Estonian World",
,Utenriks,,GB,-252.92663958118496,,,,,en,0.9999999999999998,en,agree,https://www.theguardian.com/global-development/2025/oct/04/maya-heineken-brewery-yucatan-mexico-cenote-ring,,,2025-10-04T11:01:03+00:00,,,,Økonomi,2.4763926325317005,481,False,,,,html-enriched,The Guardian (UK),https://www.theguardian.com/uk,Indigenous groups in Mexico opposed to the planned brewery say families already have little access to water – and that their way of life is also under threat,Trouble brewing: Maya people in Yucatán fear new Heineken plant’s thirst for water | Global development | The Guardian,
,Utenriks,,ES,-319.25588348508234,,,,,en,1.0,en,agree,https://english.elpais.com/international/2025-09-28/in-cuba-the-revolution-has-broken-its-promises-hunger-and-homelessness-are-on-the-rise.html,,,2025-09-28T04:00:00+00:00,,,,Økonomi,1.5855479983312195,527,False,,,,html-enriched,EL PAÍS (EN),https://english.elpais.com/,"While the official narrative tries to avoid the word ‘poverty,’ the inequality that the revolutionaries promised to eradicate is increasingly evident","In Cuba, the Revolution has broken its promises: Hunger and homelessness are on the rise | International | EL PAÍS English",
,Utenriks,,EU,-331.7337236573375,,,,,en,0.9999999999999998,en,agree,https://voxeurop.eu/en/libya-eu-mediterranean-pact-migration-economy/,,,2025-09-02T12:35:40+02:00,,,,Økonomi,1.5725950913870252,534,False,,,,html,Voxeurop,https://voxeurop.eu/en/,"The Mediterranean Pact provides Europe with an opportunity to reconsider its regional approach to migration and its cooperation with third countries. This is a priority, says Katia Golovko, who highlights the EU's past failures.",Libya and the EU: How many times can we do the same thing and expect a different result?,
,Vitenskap,,CZ,1.0,,,,,en,1.0,en,agree,https://english.radio.cz/history,,,,,,Utenriks,Utenriks,1.525,5,False,,,,html-enriched,Radio Prague International (EN),https://english.radio.cz/,"On October 4, 1995, Czech police unveiled details of one of the most shocking crimes in the country’s modern history. Eighty-seven years ago, the Munich Agreement was signed, leading Czechoslovakia to surrender its borderlands. And thousands of bunkers became useless. Now they're for sale. Archaeologists in western Bohemia have announced a remarkable discovery: around 500 gold and silver Celtic coins, along with gold and bronze jewellery.",History | Radio Prague International,
,Vitenskap,,FR,-0.55,,,,,en,1.0,en,agree,https://www.mediapart.fr/en/journal/france/160925/french-study-reveals-high-pesticide-exposure-vineyard-neighbours,,,2025-09-16T20:29:44+02:00,,,,Økonomi,1.9296862040562468,17,False,,,,html,Mediapart (EN),https://www.mediapart.fr/en,"A study published this week by two French health agencies details a well-above-average exposure to pesticides of residents who live close to vineyards, as illustrated in urine and hair samples, and others of ambient and household air, dust and home-grown vegetables. The study was originally prompted by an unusual cluster of child cancer cases discovered in a wine-growing area of south-west France, one of which concerned Lucas Rapin (pictured) when he was aged five, and who now lives with the debilitating side effects of his successful treatment for leukaemia. Amélie Poinssot reports on the findings of the study, and hears from Rapin and his mother about their arduous experience.",French study reveals high pesticide exposure for vineyard neighbours,
,Vitenskap,,IE,-3.735875633210796,,,,,en,1.0,en,agree,https://www.irishexaminer.com//lifestyle/artsandculture/arid-41717457.html,,,2025-10-04T08:00:00+01:00,,,Utenriks,Utenriks,1.829710321779592,32,False,,,,html,Irish Examiner,https://www.irishexaminer.com/,"Máiréad Tyers was 18 when she moved from Ballinhassig to London to study at one of the world’s most prestigious drama schools. Now, with a BAFTA nomination under her belt, she talks about the best decision of her life","Mairéad Tyers: Cork-born actor on leaving for London, and The Walsh Sisters",
,Vitenskap,,MC,-5.819649699531195,,,,,en,0.9999999999872126,en,agree,https://www.monaco-tribune.com/en/2025/10/mickael-manera-the-osteopath-who-teaches-as-much-as-he-treats/,,,2025-10-02T16:32:09+00:00,,,,Økonomi,1.5096983457019149,42,False,,,,html-enriched,Monaco Tribune (EN),https://www.monaco-tribune.com/en/,"At the Palazzo della Scala, the young practitioner is shaking up the codes of traditional osteopathy with a combination of rigorous science, psychology",Mickael Manera: the osteopath who teaches as much as he treats,
,Vitenskap,,EU,-7.852462237597859,,,,,en,0.9999999936953003,en,agree,https://www.politico.eu/article/food-wrecking-planet-europe-lost-appetite-change/,,,2025-10-02T22:30:00Z,,,Utenriks,Utenriks,1.332822689209559,51,False,,,,html,Politico Europe,https://www.politico.eu/,"A landmark study says food systems are breaching Earth’s limits. Europe once promised to lead the way, but the revolution fizzled.",Food is wrecking the planet. And Europe has lost its appetite for change.,
,Vitenskap,,AT,-9.862964367343675,,,,,en,0.999999997446112,en,agree,https://apnews.com/video/jane-goodall-pioneering-conservationist-and-primatologist-dies-at-91-738c818c26d849c8a7440a960895800f,,,2025-10-01T20:59:31.614Z,,,,Økonomi,1.1586099560343928,58,False,,,,sitemap,AP News – Austria hub,https://apnews.com/hub/austria,"Jane Goodall, the conservationist renowned for her groundbreaking chimpanzee field research and globe-spanning environmental advocacy, has died. She was 91.","Jane Goodall, pioneering conservationist and primatologist, dies at 91",
,Vitenskap,,CH,-11.864647303235236,,,,,en,0.999999999898326,en,agree,https://lenews.ch/2025/10/03/switzerlands-family-doctor-shortage-continues-to-worsen/,,,2025-10-03T16:14:24+00:00,,,,Økonomi,1.6425560529409746,67,False,,,,html-enriched,"Le News (Switzerland, EN)",https://lenews.ch/,"Switzerland faces a worsening shortage of general practitioners, according to a workforce study published on 2 October 2025. By 2035 hundreds will need replacing. Already three-quarters of practising",Switzerland’s family-doctor shortage continues to worsen,
,Vitenskap,,DK,-14.32139589844169,,,,,da,0.999999999999624,da,agree,https://politiken.dk/danmark/sundhed/art10562220/Nogle-er-s%C3%A5-invaliderede-at-de-ikke-kan-indg%C3%A5-i-hendes-forskning-om-diagnosen,,,2025-10-04T10:25:41+00:00,,,,Økonomi,2.2637233975327486,76,False,,,,html-enriched,Politiken – Seneste nyt (DA),https://politiken.dk/,"Sundhed | Stil spørgsmål om sundhed i Bente Klarlunds brevkasse. Vi gør dig klogerere på krop, sind, alder, motion, sex, sundhed, sygdom og bevægelse.","Nogle er så invaliderede, at de ikke kan indgå i hendes forskning om diagnosen",
,Vitenskap,,DE,-19.6544673622666,,,,,en,0.999999999994131,en,agree,https://www.spiegel.de/international/world/expedition-to-the-north-pole-polar-researchers-fear-an-ecological-collapse-in-the-arctic-a-640a73ff-0fcc-4593-9ab0-dae85ca146c6,,,2025-09-17T17:47:00+00:00,,,,Økonomi,1.5649566678121811,96,False,,,,html-enriched,Der Spiegel – International,https://www.spiegel.de/international/,The research ship Polarstern spent two months in the ice of the Arctic this summer. What they found could be evidence of an ecological collapse.,Expedition to the North Pole: Polar Researchers Fear an Ecological Collapse in the Arctic - DER SPIEGEL,
,Vitenskap,,GR,-24.859423094100247,,,,,en,0.9999999999971336,en,agree,https://www.ekathimerini.com/politics/foreign-policy/1282866/turkish-survey-ship-sails-near-lesvos/,,,2025-10-04T00:00:00+00:00,,,,Økonomi,1.708099926758976,114,False,,,,html-enriched,Kathimerini English Edition,https://www.ekathimerini.com/,"A Turkish research vessel left the Aegean port of Izmir late on Friday and was sailing north of the Greek island of Lesvos near the Turkish coast on Saturday, tracking data from marinetraffic.com showed.",Turkish survey ship sails near Lesvos | eKathimerini.com,
,Vitenskap,,ES,-27.319374983110407,,,,,en,0.999999999941967,en,agree,https://english.elpais.com/science-tech/2025-10-03/the-repairome-a-catalog-of-dna-scars-sheds-light-on-a-path-to-fighting-cancer-resistance.html,,,2025-10-03T10:41:18+00:00,,,,Økonomi,1.7027109223355676,120,False,,,,html-enriched,EL PAÍS (EN),https://english.elpais.com/,Researchers say the catalog has already led to the identification of genetic mechanisms involved in kidney cancer and will help develop personalized treatments in oncology,The REPAIRome: A catalog of DNA scars sheds light on a path to fighting cancer resistance | Science | EL PAÍS English,
,Vitenskap,,NL,-39.12942357943851,,,,,en,1.0,en,agree,https://www.dutchnews.nl/2025/09/im-okay-with-herring-i-am-even-ok-with-rain-365-days-a-year/,,,2025-09-25T07:03:53+00:00,,,,Økonomi,2.2027502725104195,152,False,,,,html-enriched,DutchNews.nl,https://www.dutchnews.nl/,"Ukrainian national Oleksandr Mialyk came to the Netherlands as a research student in 2019 and was far away from family and friends when Russia invaded his home country in February 2022. He’s taken up the tikkie, loves life in Enschede and would like to meet DJ Armin van Buuren. How did you end up in the Netherlands? As a child, I remember helping my father grow vegetables in our garden. From an early age, I became fascinated by how all...","""I'm okay with herring, I am even ok with rain, 365 days a year"" - DutchNews.nl",
,Vitenskap,,EE,-45.71497311119813,,,,,en,0.9999999973860608,en,agree,https://news.err.ee/1609816383/new-method-developed-in-estonia-speeds-up-heart-disease-research,,,2025-10-01T15:52:00+0300,,,,Økonomi,1.282619140998271,170,False,,,,html,ERR News (EN),https://news.err.ee/,"Researchers at TalTech have developed a faster, more reliable way to track molecule movement in living cells, opening doors to deeper studies.",New method developed in Estonia speeds up heart disease research,
,Vitenskap,,GB,-48.52684078347372,,,,,en,0.9999996975956512,en,agree,https://www.theguardian.com/science/2025/oct/04/saturn-moon-enceladus-life-carbon,,,2025-10-04T08:00:00+00:00,,,,Økonomi,1.848772212766768,178,False,,,,html-enriched,The Guardian (UK),https://www.theguardian.com/uk,Discovery of wide array of carbon-based substances on Enceladus shows solar system is fertile hunting ground,Signs of life? Why Saturn moon offers hope of finding ET in Earth’s back yard | Saturn | The Guardian,
,Vitenskap,,EE,-55.1271725209332,,,,,en,0.9999999972618928,en,agree,https://estonianworld.com/knowledge/estonian-scientist-triin-laisk-shortlisted-for-natures-inspiring-women-in-science-award/,,,2025-09-23T13:16:02+00:00,,,,Økonomi,1.5375753847507978,193,False,,,,html-enriched,Estonian World (EN),https://estonianworld.com/,Estonian geneticist Triin Laisk is the first Baltic scientist shortlisted for Nature’s prestigious Inspiring Women in Science award.,Estonian scientist Triin Laisk shortlisted for Nature’s Inspiring Women in Science award,
,Vitenskap,,EU,-67.38739633257065,,,,,en,1.0,en,agree,https://www.euronews.com/my-europe/2025/10/03/european-commission-to-consider-fund-for-eu-wide-access-to-abortion,,,2025-10-03T09:53:53+00:00,,,,Økonomi,1.9205402576393096,222,False,,,,html-enriched,Euronews (EN),https://www.euronews.com/,"The European Commission will study a proposal to create a fund to help women access safe abortions when they cannot do so in their own countries due to restrictive laws, following a citizens’ campaign that gathered one million signatures across the EU. #EuropeNews",European Commission to consider fund for EU-wide access to abortion | Euronews,
,Økonomi,,FI,1.0,,,,,en,1.0,en,agree,https://www.helsinkitimes.fi/business/28061-metsae-group-prepares-to-cut-540-jobs-in-finland-amid-losses.html,,,2025-10-02T18:35:13+00:00,,,,Teknologi,2.2218457907086124,3,False,,,,html-enriched,Helsinki Times (EN),https://www.helsinkitimes.fi/,"Metsä Group has announced statutory negotiations that may lead to the loss of 800 permanent jobs, with 540 of them in Finland. The move follows a cost-saving programme aimed at securing €300m in annual savings as the forestry company struggles with weak demand and mounting losses. The company said the cuts will affect all its business areas and group operations. No factories are expected to be shut down, but the measures include restructuring, changes in duties, and efficiency improvements across pr...",Metsä Group prepares to cut 540 jobs in Finland amid losses - Helsinki Times,
,Økonomi,,CH,-2.933375633210796,,,,,en,0.999999999554581,en,agree,https://lenews.ch/2023/05/04/setting-up-a-business-in-switzerland-a-guide/,,,2023-05-04T15:14:00+00:00,,,,Teknologi,1.4825942771556484,29,False,,,,html-enriched,"Le News (Switzerland, EN)",https://lenews.ch/,Brought to you by Winbiz online accounting for Swiss businesses. So you have decided to start a business. You have a business plan and are ready to get started. Before you launch you need a name and,Setting up a business in Switzerland – a guide,
,Økonomi,,CZ,-6.78246223759786,,,,,en,0.9999999999824508,en,agree,https://praguemonitor.com/czechia/03/11/2023/cnb-improves-estimate-of-this-year-s-public-finance-deficit-to-3-6-of-gdp/,,,2023-11-03T10:39:54+00:00,,,,Teknologi,1.5951188593174737,46,False,,,,html-enriched,Prague Monitor (EN),https://praguemonitor.com/,"In its latest economic projection, the Czech National Bank (CNB) has revised its estimate for this year's public finance deficit to 3.6% of the gross domestic",CNB Improves Estimate Of This Year's Public Finance Deficit To 3.6 % Of GDP - Prague Monitor,
,Økonomi,,BE,-8.765464367343673,,,,,en,0.9999968769088612,en,agree,https://www.brusselstimes.com/opinions,,,,,,Utenriks,Utenriks,0.7687499999999999,55,False,,,,html-enriched,The Brussels Times (EN),https://www.brusselstimes.com/,"The Brussels Times - News and analysis on politics, Brussels, EU Affairs, business, world, national news, and more.",Opinions | The Brussels Times,
,Økonomi,,MC,-10.627147303235237,,,,,en,0.9999958387379724,en,agree,https://news.mc/2025/10/03/condamine-market-set-for-major-2026-transformation-while-trading-continues/,,,2025-10-03T11:32:36+00:00,,,,Teknologi,1.4627094816149109,63,False,,,,html-enriched,NEWS.MC – Monaco (EN),https://news.mc/,Condamine Market set for major 2026 transformation while trading continues,Condamine Market set for major 2026 transformation while trading continues - NEWS.MC - Monaco News,
,Økonomi,,PL,-12.933895898441689,,,,,en,0.9999972719743642,en,agree,https://notesfrompoland.com/category/editors-pick/,,,,,,,Teknologi,1.36875,72,False,,,,html-enriched,Notes from Poland,https://notesfrompoland.com/,"Business,Editor's pick,Energy & Climate,Insights,Podcast,Politics Alicja PtakPoland’s energy transition is being held back by its legacy as a major coal producer and political inaction.",Editor’s pick | Notes From Poland,
