_link_txt,category,combined_text,country,curation_before_similarity,dedupe_reason,duplicate_of,is_trump_story,key_toks_title,lang,lang_conf,lang_detected,lang_method,link,most_debated_score,most_debated_score_raw,published_iso,reddit_match_count,reddit_matches,secondary_category,secondary_category_hint,shortlist_score,sim_cluster_id,sim_is_dupe,sim_score,sim_title_ratio,sim_to_index,source_method,source_name,source_url,summary,title,trump_exempt
,Kultur,,LU,0.06,,,,,en,0.9999999998136082,en,agree,https://www.luxtimes.lu/yourluxembourg/luxembourgguide/explore-the-luxembourg-urban-garden-trail-across-four-city-parks/74038963.html,,,2025-07-01T07:56:39.000Z,,,Vitenskap,Vitenskap,1.3108751448164715,11,False,,,,html,Luxembourg Times (EN),https://www.luxtimes.lu/,"Discover the cultural and science hubs, an orchid greenhouse, urban farm, art installations and an aqua tunnel or take part in hundreds of LUGA events during summer",Explore the Luxembourg Urban Garden trail across four city parks,
,Kultur,,DE,-3.3783756332107964,,,,,en,0.9999999999993524,en,agree,https://www.tagesspiegel.de/kultur/journey-to-the-end-of-the-universe-4814362.html,,,2014-03-10T11:16:33.000Z,,,Vitenskap,Vitenskap,1.4375197188089208,30,False,,,,html,Tagesspiegel – In English,https://www.tagesspiegel.de/kultur/themen/in-english,"Sound&Fury's ""Going Dark"" completed a five day run at the Science Museum in London on Sunday. Co-directing the piece was the Tagesspiegel's very own Mark Espiner. Ramona Mosse reports from London.","""Going Dark"" at the Science Museum: Journey to the end of the universe",
,Kultur,,IE,-11.187147303235236,,,,,en,0.9999999999999928,en,agree,https://www.independent.ie/regionals/meath/news/meath-family-run-distillery-earns-place-at-prestigious-international-whiskey-festival/a1648476818.html,,,2025-10-03T05:00:00+02:00,,,Utenriks,Utenriks,1.383342686259429,64,False,,,,sitemap,Irish Independent,https://www.independent.ie/,"Boann Distillery has achieved international recognition, with one of its whiskeys selected as one of only seven single cask releases specially bottled by The Whisky Exchange for this year’s Whisky Show, London.",Meath family-run distillery earns place at prestigious international whiskey festival,
,Kultur,,IE,-13.56139589844169,,,,,en,0.9999954783198052,en,agree,https://www.irishexaminer.com//sponsored/arid-41711198.html,,,2025-09-26T08:58:00+01:00,,,Teknologi,Teknologi,1.245136151279207,73,False,,,,html,Irish Examiner,https://www.irishexaminer.com/,Gas Networks Ireland is continuously improving on an already high standard of customer service,"Listening, learning, consistent delivery: Gas Networks Ireland’s customer focused culture",
,Kultur,,CZ,-15.7264788032894,,,,,en,0.9999999877292778,en,agree,https://praguemonitor.com/culture/06/09/2023/prague-art-week-2023-check-out-this-year-s-program/,,,2023-09-06T09:07:24+00:00,,,Utenriks,Utenriks,1.503859768538923,82,False,,,,html-enriched,Prague Monitor (EN),https://praguemonitor.com/,"Prague Art Week, a renowned international festival, is gearing up to captivate the Prague art scene and its audience with a diverse array of artistic",Prague Art Week 2023. Check Out This Year's Program. - Prague Monitor,
,Kultur,,GR,-20.453375412685467,,,,,en,0.9999999999990888,en,agree,https://www.ekathimerini.com/culture/1282778/pallas-theater-presents-two-productions-with-english-surtitles-for-its-2025-season/,,,2025-10-03T00:00:00+00:00,,,Utenriks,Utenriks,1.7323977534094293,98,False,,,,html-enriched,Kathimerini English Edition,https://www.ekathimerini.com/,"This season, Athens’ Pallas Theatre will present two high-profile productions, both of which will be performed in Greek with English subtitles to make them accessible to international audiences.",Pallas Theater stages two productions with English subtitles | eKathimerini.com,
,Kultur,,GB,-22.694423094100244,,,,,en,0.9999999999648458,en,agree,https://www.theguardian.com/culture/2025/oct/04/learn-history-opera-luddites-deal-with-ai,,,2025-10-04T09:00:02+00:00,,,Teknologi,Teknologi,1.9398265388489424,107,False,,,,html-enriched,The Guardian (UK),https://www.theguardian.com/uk,New work by Ben Crick and Kamal Kaan suggests we could benefit from knowing more about the ‘machine-wreckers’,‘Let’s learn from that history’: opera looks to luddites for how to deal with AI | Culture | The Guardian,
,Kultur,,CH,-30.807613034479875,,,,,en,0.9999999992641376,en,agree,https://lenews.ch/2016/11/11/art-in-an-alpine-setting-the-pierre-arnaud-foundation-in-valais/,,,2016-11-11T11:30:49+00:00,,,,Økonomi,1.5987756483365327,130,False,,,,html-enriched,"Le News (Switzerland, EN)",https://lenews.ch/,"On 12 November 2016, Museums in Switzerland are free. Valais resident Peter Hulm suggests going to the Pierre Arnaud Foundation in Lens, just below Crans-Montana. Not just because of its magnificen",Art in an alpine setting – the Pierre Arnaud Foundation in Valais,
,Kultur,,ES,-42.41497311119812,,,,,en,0.9999999974558272,en,agree,https://english.elpais.com/international/2025-10-04/tren-de-aragua-makes-its-way-into-peruvian-prisons.html,,,2025-10-04T04:00:00+00:00,,,Utenriks,Utenriks,1.6705122333325066,163,False,,,,html-enriched,EL PAÍS (EN),https://english.elpais.com/,"Venezuelan inmates, a population that has grown from 48 to over 4,000, are imposing their jail culture",Tren de Aragua makes its way into Peruvian prisons | International | EL PAÍS English,
,Kultur,,MC,-49.257143039509096,,,,,en,0.9999993221246438,en,agree,https://news.mc/2025/09/25/monacos-national-committee-of-unesco-arts-association-marks-70th-anniversary-with-special-exhibition/,,,2025-09-25T13:27:05+00:00,,,,Økonomi,1.4617666026304716,180,False,,,,html-enriched,NEWS.MC – Monaco (EN),https://news.mc/,Monaco’s National Committee of UNESCO Arts Association marks 70th anniversary with special exhibition,Monaco’s National Committee of UNESCO Arts Association marks 70th anniversary with special exhibition - NEWS.MC - Monaco News,
,Kultur,,DK,-59.01704281128838,,,,,da,0.9999999999990804,da,agree,https://politiken.dk/kultur/musik/art10561205/Fredag-aften-var-de-i-gang-med-at-kortslutte-den-verden-vi-kender,,,2025-10-04T04:13:31+00:00,,,,Økonomi,1.718374008901176,202,False,,,,html-enriched,Politiken – Seneste nyt (DA),https://politiken.dk/,"Musik | Nyheder og anmeldelser af musik, koncerter og festivaler som Roskilde og Copehagen Jazz Festival. Se vores top-100 over de bedste danske popsange.","Fredag aften var de i gang med at kortslutte den verden, vi kender",
,Kultur,,FR,-80.06930008012408,,,,,en,1.0,da,langid_confident,https://www.lemonde.fr/culture/article/2025/10/04/quiz-de-francais-a-tes-risques-la-gauloiserie_6644396_3246.html,,,2025-10-04T11:00:19+02:00,,,,Økonomi,1.605343214676609,249,False,,,,sitemap,Le Monde (EN),https://www.lemonde.fr/en/,"Mots rares, accords subtils, étymologies obscures, expressions surannées… Explorez les arcanes de la langue française avec ce questionnaire retors et facétieux.",Quiz de culture générale : testez votre niveau de français (gaulois !),
,Kultur,,AT,-83.57255687441453,,,,,en,1.0,en,agree,https://apnews.com/video/indians-celebrate-durga-puja-with-dancing-prayers-shopping-and-food-d2aadcc8c03545cdbd2e1c0412e9ad64,,,2025-10-02T19:14:33.251Z,,,,Økonomi,1.3938264028574152,257,False,,,,sitemap,AP News – Austria hub,https://apnews.com/hub/austria,"Durga Puja is the biggest festival for India’s Bengali community and is marked by the installation of huge, elaborately decorated images of the goddess at community shrines, with feasts, music and dance to celebrate the victory of good over evil.","Indians celebrate Durga Puja with dancing, prayers, shopping and food",
,Kultur,,EU,-126.78383050076869,,,,,en,1.0,en,agree,https://voxeurop.eu/en/guest_author/bernardo-alvarez-villar-artola/,,,,,,,Økonomi,1.74375,331,False,,,,html-enriched,Voxeurop,https://voxeurop.eu/en/,"Bernardo Álvarez-Villar Artola is a Spanish journalist based in Madrid. He has a bachelor’s degree in Psychology and is a student of Geography and History. He writes about the environment, culture, labor and human rights in numerous national and regional media publications in Spain. His work has been published by…",Bernardo Álvarez-Villar Artola – Voxeurop,
,Kultur,,GB,-138.12939654039576,,,,,en,0.9999950312724,en,agree,https://monocle.com/contributors/charlotte-mcdonald-gibson/,,,,,,Økonomi,Økonomi,1.2,346,False,,,,html-enriched,Monocle (site),https://monocle.com/,"Monocle is a global briefing covering international affairs, business, culture and design.",Charlotte McDonald-Gibson Archives - Monocle,
,Kultur,,EE,-149.77302247706444,,,,,en,0.9999999999999968,en,agree,https://news.err.ee/1609819827/tallinn-zoo-and-botanic-garden-join-free-museum-sundays-till-end-of-2025,,,2025-10-03T18:58:00+0300,,,,Økonomi,1.501337027797636,364,False,,,,html,ERR News (EN),https://news.err.ee/,"Every first Sunday of the month, a host of Tallinn's top museums offer free entry to visitors, with Tallinn Zoo and Botanic Garden joining the program from this week (October 5).",Tallinn Zoo and Botanic Garden join free 'Museum Sundays' till end of 2025,
,Meninger,,GB,-0.515,,,,,en,0.9999997962284906,en,agree,https://monocle.com/newsletters/,,,,,,Kultur,Kultur,0.76625,16,False,,,,html-enriched,Monocle (site),https://monocle.com/,"Newsletters Across the week, Monocle has you covered for everything from the latest current affairs and culture commentary from our...",Newsletters - Monocle,
,Meninger,,AT,-1.9917166200173744,,,,,en,1.0,en,agree,https://apnews.com/video/breaking-down-napheesa-collier-comments-about-wnba-leadership-00000199a6b8dc83a399ffb9b6fd0000,,,2025-10-02T20:59:13.850Z,,,,Økonomi,1.435886369522699,25,False,,,,sitemap,AP News – Austria hub,https://apnews.com/hub/austria,"Napheesa Collier delivered a blistering assessment of the WNBA and its commissioner on Tuesday as she sat in front of the media with a prepared statement, disclosing private conversations she said she had with Cathy Engelbert that portrayed her as a leader who lacks accountability.",Breaking down Napheesa Collier comments about WNBA leadership,
,Meninger,,PL,-3.970875633210796,,,,,en,0.9999999999999952,en,agree,https://notesfrompoland.com/2025/10/03/polish-citys-infamous-communist-era-monument-saved-from-demolition/,,,2025-10-03T11:00:50+00:00,,,Økonomi,Økonomi,1.7836431205696002,34,False,,,,html-enriched,Notes from Poland,https://notesfrompoland.com/,"Notes from Poland is run by asmall editorial teamand is published by an independent, non-profit foundation that is funded through donations from our readers. We cannot do what we do without your support.",Polish city’s (in)famous communist-era monument saved from demolition | Notes From Poland,
,Meninger,,EU,-7.274962237597861,,,,,en,0.999999999999988,en,agree,https://voxeurop.eu/en/source/cartoon-movement/,,,,,,Teknologi,Teknologi,1.62125,48,False,,,,html-enriched,Voxeurop,https://voxeurop.eu/en/,"The Cartoon Movement was created in 2010 and states itself as ""a community of international editorial cartoonists and fans of political satire"". It claims to be ""the Internet's #1 publishing platform for high quality political cartoons and comics journalism"" and is managed by Dutch cartoonist Tjeerd.",Cartoon movement - Voxeurop,
,Meninger,,EU,-10.090464367343674,,,,,en,0.9999999999919488,en,agree,https://www.euronews.com/culture/culture-series/modern-nomads,,,2025-06-11T13:00:57+00:00,,,Utenriks,Utenriks,1.581974568274345,59,False,,,,html-enriched,Euronews (EN),https://www.euronews.com/,"Modern Nomads is a fresh editorial series that follows a reporter on a journey to explore a diverse array of cultural delights in Kazakhstan, blending modernity and tradition with an outward-looking international perspective.",Latest episodes and news | Modern Nomads | Euronews,
,Meninger,,EE,-12.224647303235235,,,,,en,0.9999971139352912,en,agree,https://estonianworld.com/category/opinion/,,,2025-09-21T00:00:00+00:00,,,Utenriks,Utenriks,0.8498985448770657,68,False,,,,html-enriched,Estonian World (EN),https://estonianworld.com/,Opinion articles by Estonian and global opinion leaders,Opinion Archives - Estonian World,
,Meninger,,GR,-14.608895898441691,,,,,en,0.999999998511173,en,agree,https://www.ekathimerini.com/multimedia/images/1281531/new-led-lights-in-city-center-divide-opinion/,,,2025-09-22T00:00:00+00:00,,,,Økonomi,1.4878883382418455,79,False,,,,html-enriched,Kathimerini English Edition,https://www.ekathimerini.com/,"The transition from the pale yellow light of the old, energy-intensive bulbs to cooler, environmentally friendly LEDs has caused mixed reactions in Athens.",New LED lights in city center divide opinion | eKathimerini.com,
,Meninger,,SE,-19.1419673622666,,,,,sv,0.999999916710572,sv,agree,https://www.dn.se/debatt/vara-underrattelser-visar-sanningen-bakom-putins-siffror/,,,2025-10-03T20:00:00.760+02:00,,,Økonomi,Økonomi,1.057484427031623,94,False,,,,sitemap,Dagens Nyheter (SE),https://www.dn.se/,DN Debatt. Finansministern: Internationella finansiella institutioner hjälper Ryssland att sprida propaganda.,Finansminister Elisabeth Svantesson om Putins dolda inflation,
,Meninger,,DE,-27.214374983110407,,,,,en,1.0,en,agree,https://www.spiegel.de/international/germany/muellermilch-boss-with-fringe-friends-a-german-dairy-billionaires-links-to-the-far-right-a-1ced233a-e3f5-4a76-8086-444ec3c9a166,,,2025-09-06T16:19:00+00:00,,,,Økonomi,1.7354896995259663,119,False,,,,html-enriched,Der Spiegel – International,https://www.spiegel.de/international/,"The dairy billionaire Theo Müller is friends with Alice Weidel, the co-leader of the right-wing extremist party Alternative for Germany. She and other fringe figures were invited to his extravagant birthday party.",Müllermilch Boss with Fringe Friends: A German Dairy Billionaire's Links to the Far Right - DER SPIEGEL,
,Meninger,,EU,-29.56792513991497,,,,,en,0.9999977321882372,en,agree,https://www.politico.eu/section/commentary/,,,,,,Utenriks,Utenriks,0.73875,127,False,,,,html-enriched,Politico Europe,https://www.politico.eu/,Views and reportage from Europe and beyond.,Commentary – POLITICO,
,Meninger,,IE,-35.801260519928846,,,,,en,0.9999999847848684,en,agree,https://www.independent.ie/irish-news/politics/dup-opposition-to-dual-language-policy-not-motivated-by-anti-irish-sentiment/a881788831.html,,,2025-10-03T08:14:39+02:00,,,,Økonomi,1.269441188439254,143,False,,,,sitemap,Irish Independent,https://www.independent.ie/,DUP leader Gavin Robinson has rejected any suggestion his party’s opposition to Belfast City Council’s new dual language policy is motivated by “anti-Irish” sentiment.,DUP opposition to dual language policy ‘not motivated by anti-Irish sentiment’,
,Meninger,,NL,-51.65964303950909,,,,,en,1.0,en,agree,https://www.dutchnews.nl/2025/10/wine-watch-heritage-reds-for-autumn-that-drink-like-rose/,,,2025-10-01T15:18:01+00:00,,,,Økonomi,2.1785796194069933,184,False,,,,html-enriched,DutchNews.nl,https://www.dutchnews.nl/,"Each month, our resident wine expert, Vicky Hampton, shares her seasonal wine picks for those on a budget and those with a little more cash to splash. October’s column covers categories that may be unfamiliar to many – Clarete and Palhete – but are ideal for in-between seasons. As I write this, we’re being treated to the last few days of Indian summer. It may be dark by eight o’clock, but we sit outside straight after work, enjoying a chilled...",Wine Watch: Heritage reds for autumn that drink like rosé - DutchNews.nl,
,Meninger,,IE,-58.13831591201528,,,,,en,0.9999952668093718,en,agree,https://www.irishexaminer.com/farming/,,,,,,,Økonomi,0.7312500000000001,200,False,,,,html-enriched,Irish Examiner,https://www.irishexaminer.com/,"The latest agriculture news, advice, analysis and opinion for Ireland's farmers.",Farming News Ireland - Irish Examiner,
,Meninger,,DE,-61.83204281128838,,,,,en,0.9999999999999792,en,agree,https://www.tagesspiegel.de/kultur/mata-the-messiah-of-manchester-4812019.html,,,2014-01-24T15:41:00.000Z,,,,Økonomi,1.52001951189114,207,False,,,,html,Tagesspiegel – In English,https://www.tagesspiegel.de/kultur/themen/in-english,"Juan Mata is Manchester United's new Messiah. Our columnist explain why the club was willing to pay so much, the extent of the expectation on the Spaniard's shoulders, and why the helicopter was so important.",Live von der Insel - The English Football Column: Mata: The Messiah of Manchester,
,Meninger,,GB,-65.19989633257065,,,,,en,0.9999999934679366,en,agree,https://www.theguardian.com/world/2025/oct/04/sanae-takaichi-expected-to-become-japans-first-female-pm-after-winning-ruling-party-leadership,,,2025-10-04T08:24:21+00:00,,,,Økonomi,1.8578081697552984,216,False,,,,html-enriched,The Guardian (UK),https://www.theguardian.com/uk,Margaret Thatcher admirer beat her more moderate rival to become leader of Liberal Democratic party,Japan poised to get first female PM after Sanae Takaichi wins ruling party leadership | Japan | The Guardian,
,Meninger,,ES,-72.09697643532631,,,,,en,0.999999999999994,en,agree,https://english.elpais.com/author/jordi-alonso-martinez-yanez/,,,2025-10-03T18:17:09+00:00,,,,Økonomi,1.4940442897001132,231,False,,,,html-enriched,EL PAÍS (EN),https://english.elpais.com/,"All articles and news stories written by Jordi Alonso Martínez Yañez published in EL PAÍS. Latest articles, news and opinion columns.",Articles written by Jordi Alonso Martínez Yañez | EL PAÍS,
,Politikk,,EE,-1.4842166200173743,,,,,en,1.0,en,agree,https://news.err.ee/1609819671/raul-rebane-struggle-for-the-past-or-the-personality-myths-of-estonian-elections,,,2025-10-03T17:38:00+0300,,,Meninger,Meninger,1.7508123795781776,20,False,,,,html,ERR News (EN),https://news.err.ee/,"Attaining the role of a ""father of the people"" requires special circumstances, even a kind of social anomaly. Candidates appear in every country and election, but in Estonia today only Mihhail Kõlvart fits the bill, writes Raul Rebane in his Vikerraadio commentary.",Raul Rebane: Struggle for the past or the personality myths of Estonian elections,
,Politikk,,FR,-8.152964367343673,,,,,en,1.0,en,agree,https://www.mediapart.fr/en/journal/france/260925/france-finally-tackling-state-crime,,,2025-09-26T13:37:18+02:00,,,Meninger,Meninger,1.7478274553192954,52,False,,,,html,Mediapart (EN),https://www.mediapart.fr/en,"Political and financial crime is one of the French Republic’s best-kept secrets. It poisons the state quietly, to the detriment of the citizens who have to pay the price. That is why the judgement handed down on September 25th in the Libyan funding affair involving former president Nicolas Sarkozy and other high-profile defendants is of vital importance, writes Mediapart’s publishing editor in this op-ed article.",France is finally tackling state crime,
,Politikk,,DK,-21.19692309410025,,,,,da,0.9999999984538528,da,agree,https://nyheder.tv2.dk/politik/2025-10-04-v-formand-vil-lave-nyt-forlig-om-pensionsalder-efter-valg,,,2025-10-04T10:18:14.950000+00:00,,,Underholdning,Underholdning,2.042029238280723,101,False,,,,html-enriched,TV 2 Nyheder (DA),https://nyheder.tv2.dk/,"SVM-regeringen bliver ikke enige om et nyt pensionssystem pÃ¥ denne side af et valg, siger Venstres formand.",V-formand vil lave nyt forlig om pensionsalder efter valg - TV 2,
,Politikk,,CZ,-28.52761303447988,,,,,en,0.9999998870071888,en,agree,https://praguemonitor.com/culture/06/09/2023/polish-minister-compares-holland-s-film-to-nazi-propaganda/,,,2023-09-06T16:44:27+00:00,,,Underholdning,Underholdning,1.5413598144502498,123,False,,,,html-enriched,Prague Monitor (EN),https://praguemonitor.com/,"Poland's Justice Minister Zbigniew Ziobro, along with several politicians from the ruling parties, have launched vehement criticism against Agnieszka",Polish Minister Compares Holland's Film To Nazi Propaganda - Prague Monitor,
,Politikk,,NL,-33.82942357943851,,,,,en,1.0,en,agree,https://www.dutchnews.nl/2025/10/mri-scan-for-women-with-dense-breast-tissue-one-step-closer/,,,2025-10-01T10:45:16+00:00,,,Vitenskap,Vitenskap,2.189336354188852,138,False,,,,html-enriched,DutchNews.nl,https://www.dutchnews.nl/,"MRI scans for women with dense breast tissue will be included in mass screenings for breast cancer following a feasibility study by public health organisation RIVM, caretaker junior health minister Judith Tielen has said in a briefing to MPs. One in 12 women between 50 and 70 who participate in the mass screening has dense breast tissue. They are at greater risk of developing tumours, but detection is more difficult, putting them at greater risk of advanced breast cancer. An...",MRI scan for women with dense breast tissue one step closer - DutchNews.nl,
,Politikk,,BE,-39.619973111198135,,,,,en,0.999998514346318,en,agree,https://brusselsmorning.com/eu-council-approves-e150bn-safe-plan-to-boost-defence-sector/73587/,,,2025-05-27T11:29:02+00:00,,,Utenriks,Utenriks,1.4756406567857026,154,False,,,,html-enriched,Brussels Morning (EN),https://brusselsmorning.com/,"Brussels (Brussels Morning Newspaper) - Today, the European Council has implemented a regulation that establishes the Security Action for Europe (SAFE) instrume",EU Council approves €150bn SAFE plan to boost defence sector,
,Politikk,,UA,-42.20934078347372,,,,,en,0.999999986260841,en,agree,https://www.rferl.org/a/russian-drone-hits-ukrainian-passenger-train-oil-refinery-attacks/33549541.html,,,2025-10-04T10:46:34+00:00,,,Teknologi,Teknologi,2.2924384301559497,162,False,,,,html-enriched,RFE/RL – Ukraine (EN),https://www.rferl.org/Ukraine,"A Russian drone has hit a passenger train, causing an unknown number of casualties in the latest strike against a civilian target in the Kremlin’s ongoing invasion of Ukraine.",'Dozens' Hurt As Russia Strikes Ukrainian Passenger Train,
,Politikk,,ES,-50.91831591201528,,,,,en,0.9999999999999984,en,agree,https://english.elpais.com/culture/2025-10-03/the-mystery-of-how-the-photo-of-robert-capas-soldier-was-taken-continues-90-years-later.html,,,2025-10-03T16:57:26+00:00,,,Kultur,Kultur,1.768410699032813,183,False,,,,html-enriched,EL PAÍS (EN),https://english.elpais.com/,"The Círculo de Bellas Artes in Madrid is hosting the largest retrospective in Spain of the photographer’s work, with 250 pieces, including images, publications, and objects on war and life",Robert Capa’s iconic Spanish Civil War photo: A mystery that endures 90 years later | Culture | EL PAÍS English,
,Politikk,,PL,-56.66739633257065,,,,,en,0.9999999999942416,en,agree,"https://www.polskieradio.pl/395/7784/artykul/3587265,poland’s-first-military-satellites-to-be-launched-in-november",,,,,,Teknologi,Teknologi,1.72375,196,False,,,,html-enriched,Polskie Radio – English,"https://www.polskieradio.pl/395,english-section","Poland will launch its first military satellites in November, Defence Minister Władysław Kosiniak-Kamysz confirmed on Wednesday during a visit to a new training centre for Ukrainian troops in southeastern Poland.",Poland’s first military satellites to be launched in November - English Section,
,Politikk,,DE,-74.80005687441454,,,,,en,1.0,en,langid_confident,https://www.tagesspiegel.de/kultur/performance-theater-mit-berliner-gewasser-rosa-luxemburg-und-eine-bruckenspringerin-9589022.html,,,2023-03-30T14:02:51.000Z,,,Kultur,Kultur,1.3875906814281187,237,False,,,,html,Tagesspiegel – In English,https://www.tagesspiegel.de/kultur/themen/in-english,Der Landwehrkanal war Schauplatz zahlreicher Verbrechen und schrecklicher Geschichten. Das Stück „Ghosts of the Landwehr Canal“ führt von damals ins Heute.,Performance-Theater mit Berliner Gewässer : Rosa Luxemburg und eine Brückenspringerin,
,Politikk,,EU,-164.0025319446714,,,,,en,0.999999990267798,en,agree,https://www.politico.eu/article/europe-democracies-danger-warn-friedrich-merz-emmanuel-macron/,,,2025-10-03T14:01:17Z,,,Utenriks,Utenriks,1.1134888607265512,385,False,,,,html,Politico Europe,https://www.politico.eu/,"Threats dwarf anything seen since the Cold War, says German chancellor.","Europe’s democracies are in danger, warn Merz and Macron",
,Politikk,,GB,-167.68532004848285,,,,,en,0.9999969938303912,en,agree,https://monocle.com/contributors/sophie-monaghan-coombs/,,,,,,Utenriks,Utenriks,1.2325,391,False,,,,html-enriched,Monocle (site),https://monocle.com/,Our favourite newsstands stock a compelling roster of global print publications and act as valuable neighbourhood hubs. Here are a...,Sophie Monaghan-Coombs - Monocle,
,Politikk,,,-203.89449804634057,,,,,,0.9999999999999992,no,agree,https://www.nrk.no/tromsogfinnmark/offer-skrevet-ut-etter-drapsforsok-_foler-seg-utrygg-1.17597241,,,2025-10-03T17:46:42+02:00,,,,Økonomi,1.1755151230835348,435,False,,,,sitemap,NRK – Toppsaker,https://www.nrk.no/,"Fornærmede, en mann i 20-årene, er skrevet ut av sykehuset etter å ha blitt utsatt for et brutalt angrep på Tromsøya 18. september. Politiet har iverksatt nødvendige sikkerhetstiltak.",Offer skrevet ut etter drapsforsøk –føler seg utrygg,
,Politikk,,CH,-355.8563596478831,,,,,en,0.9999999999936936,en,agree,https://lenews.ch/2018/10/31/how-to-run-a-swiss-business-a-guide-to-7-essential-tasks/,,,2018-10-31T21:31:31+00:00,,,Økonomi,Økonomi,1.5362829425496265,550,False,,,,html-enriched,"Le News (Switzerland, EN)",https://lenews.ch/,"Brought to you by Winbiz online accounting for Swiss businesses. Once a business is established, there are many ongoing administrative tasks required by law. The main ones are covered in this artic",8 things you must do if you’re running a Swiss business,
