_link_txt,category,combined_text,country,curation_before_similarity,dedupe_reason,duplicate_of,is_trump_story,key_toks_title,lang,lang_conf,lang_detected,lang_method,link,most_debated_score,most_debated_score_raw,published_iso,reddit_match_count,reddit_matches,secondary_category,secondary_category_hint,shortlist_score,sim_cluster_id,sim_is_dupe,sim_score,sim_title_ratio,sim_to_index,source_method,source_name,source_url,summary,title,trump_exempt
,Økonomi,,DK,-22.229423094100245,,,,,da,0.99999999999999,da,agree,https://politiken.dk/danmark/Indlandsartikler/art10555784/%C2%BBJeg-har-taget-medicin-for-adhd-i-et-%C3%A5r-men-stoppede-for-14-dage-siden-for-at-m%C3%A6rke-hvem-jeg-egentlig-er%C2%AB,,,2025-09-26T06:10:48+00:00,,,,Teknologi,1.5975451926351183,106,False,,,,html-enriched,Politiken – Seneste nyt (DA),https://politiken.dk/,"Danmark | Sektionen med Politikens undersøgende journalistik og seneste nyt indenfor politik, ret, sundhed, uddannelse, forbrug, økonomi og aktuelle temaer","»Jeg har taget medicin for adhd i et år, men stoppede for 14 dage siden for at mærke, hvem jeg egentlig er«",
,Økonomi,,LU,-29.38761303447988,,,,,en,0.999999982048053,en,agree,https://www.luxtimes.lu/luxembourg/consumer-confidence-deteriorated-in-september/94552097.html,,,2025-10-02T09:25:38.000Z,,,,Teknologi,1.0823205770793105,126,False,,,,html,Luxembourg Times (EN),https://www.luxtimes.lu/,Luxembourg households more negative on the state of their personal finances and the Grand Duchy’s economy,Consumer confidence deteriorated in September,
,Økonomi,,GR,-46.13464303950909,,,,,en,0.9999997576897168,en,agree,https://www.ekathimerini.com/economy/1282701/convergence-must-wait-longer/,,,2025-10-03T00:00:00+00:00,,,,Teknologi,1.2723977535849122,171,False,,,,html-enriched,Kathimerini English Edition,https://www.ekathimerini.com/,Greek economy will take up to 20 years to return to the level it was at before the crisis.,Convergence must wait longer | eKathimerini.com,
,Økonomi,,UA,-57.66239633257064,,,,,en,0.9999999871522685,en,agree,https://kyivindependent.com/russia-to-begin-importing-gasoline-from-asia-after-losing-nearly-40-of-refining-capacity-media-reports/,,,2025-10-01T11:53:37+00:00,,,Utenriks,Utenriks,1.5622529297474523,198,False,,,,html-enriched,Kyiv Independent (EN),https://kyivindependent.com/,"Russia is considering importing fuel from China, South Korea, and Singapore to stabilize its domestic market, according to Kommersant.","Russia to import gasoline from Asia as nearly 40% of refining capacity shuts down, media reports",
,Økonomi,,NL,-63.72947643532631,,,,,en,1.0,en,agree,https://www.dutchnews.nl/2025/10/inflation-rises-to-3-3-reversing-five-month-downward-trend/,,,2025-10-01T07:01:19+00:00,,,,Teknologi,2.1943064039543883,214,False,,,,html-enriched,DutchNews.nl,https://www.dutchnews.nl/,"The Dutch annual rate of inflation crept up to 3.3% in September, after falling to 2.8% in August, the national statistics agency CBS said on Wednesday. The increase is higher than economists had forecast. Taking seasonal influences into account, such as the price of airline tickets, consumer prices fell by 0.1% in September compared with August. The definitive figure will be published later this month. The CBS publishes two different figures for inflation. The second figure, based on EU methodology...","Inflation rises to 3.3%, reversing five month downward trend - DutchNews.nl",
,Økonomi,,GB,-75.85255687441452,,,,,en,0.9999999996432236,en,agree,https://monocle.com/radio/shows/the-entrepreneurs/eureka-03-10-25/,,,,,,Utenriks,Utenriks,1.585,239,False,,,,html-enriched,Monocle (site),https://monocle.com/,"We meet Pietro Collina, co-founder of Whitebox Cocktails, a company making full-strength, single-serve classics such as negronis, espresso martinis and...",Eureka: How Whitebox Cocktails turned a negroni into a global business selling millions of cans - Monocle,
,Økonomi,,EE,-79.02475099390857,,,,,en,0.9999999967434744,en,agree,https://news.err.ee/1609818873/slump-in-car-sales-continues-in-september,,,2025-10-03T07:59:00+0300,,,Teknologi,Teknologi,1.225675483409324,246,False,,,,html,ERR News (EN),https://news.err.ee/,"Just like throughout the year, September saw far fewer new car sales than a year ago. The used car market also remains weak, with tax uncertainty deterring buyers.",Slump in car sales continues in September,
,Økonomi,,IE,-82.04530120962941,,,,,en,0.999996484823226,en,agree,https://www.independent.ie/life/home-garden/homes/on-the-market-four-close-up-ready-homes-near-big-and-small-screen-locations/a170882267.html,,,2025-10-03T06:30:00+02:00,,,,Teknologi,0.9435124076857034,253,False,,,,sitemap,Irish Independent,https://www.independent.ie/,"Leafy Lodge, Mayfield, Claremorris, Co Mayo",On the market: Four close-up ready homes near big and small screen locations,
,Økonomi,,ES,-89.8042930801609,,,,,en,0.9999999999998036,en,agree,https://english.elpais.com/international/2025-10-04/ortegas-border-business-6000-to-be-able-to-return-to-nicaragua.html,,,2025-10-04T04:00:00+00:00,,,Utenriks,Utenriks,1.7805122332486467,267,False,,,,html-enriched,EL PAÍS (EN),https://english.elpais.com/,"Nicaraguans have denounced extortion upon returning to their country, while UN documents denials of re-entry due to alleged ties to the opposition","Ortega’s border business: $6,000 to be able to return to Nicaragua | International | EL PAÍS English",
,Økonomi,,EU,-101.54752964800213,,,,,en,0.9999994813098708,en,agree,https://www.euronews.com/business/markets,,,2025-09-29T14:54:20+00:00,,,Utenriks,Utenriks,1.3256455078951366,292,False,,,,html-enriched,Euronews (EN),https://www.euronews.com/,"Latest news from European and global financial markets. Comprehensive European markets coverage with breaking news, analysis and views. European investing, European personal finance, European Wealth Management. Currencies, commodities, Cryptocurrency.",Markets | Business | Euronews,
apnews com video stephen-king-tops-list-of-censored-authors-in-us-schools-05131ade48c4441a87b4665ff4951ad8,Mest debattert,"Stephen King tops list of censored authors in US schools. PEN America’s “Banned in the USA,” report found Stephen King as the author most likely to be censored.. apnews com video stephen-king-tops-list-of-censored-authors-in-us-schools-05131ade48c4441a87b4665ff4951ad8",AT,,,,False,"['authors', 'king', 'stephen', 'tops', 'schools', 'list']",en,0.9999997855864368,en,agree,https://apnews.com/video/stephen-king-tops-list-of-censored-authors-in-us-schools-05131ade48c4441a87b4665ff4951ad8,10.157632639699958,10.157632639699958,2025-10-02T23:10:31.325Z,1,"[{""subreddit"": ""books"", ""r_title"": ""Stephen King is the most banned author in US schools, PEN report says"", ""permalink"": ""https://www.reddit.com/r/books/comments/1nvddid/stephen_king_is_the_most_banned_author_in_us/"", ""debate_score"": 12180, ""sim"": 0.6223894694214269, ""decided_by"": ""tfidf_gate""}]",,Økonomi,0.9574867596165376,,,,,,sitemap,AP News – Austria hub,https://apnews.com/hub/austria,"PEN America’s “Banned in the USA,” report found Stephen King as the author most likely to be censored.",Stephen King tops list of censored authors in US schools,False
kyivindependent com ukrainian-drones-strike-one-of-russias-largest-refineries-in-southern-urals,Mest debattert,"One of Russia's largest refineries in southern Urals hit by Ukrainian drones, SBU source confirms. The facility lies about 1,400 kilometers (870 miles) from Ukraine-controlled territory.. kyivindependent com ukrainian-drones-strike-one-of-russias-largest-refineries-in-southern-urals",UA,,,,False,"['sbu', 'urals', 'refineries', 'largest', 'southern', 'confirms']",en,0.999996257412972,en,agree,https://kyivindependent.com/ukrainian-drones-strike-one-of-russias-largest-refineries-in-southern-urals/,9.527247096750544,9.527247096750544,2025-10-03T10:09:42+00:00,1,"[{""subreddit"": ""worldnews"", ""r_title"": ""One of Russia's largest refineries in southern Urals hit by Ukrainian drones"", ""permalink"": ""https://www.reddit.com/r/worldnews/comments/1nww6ys/one_of_russias_largest_refineries_in_southern/"", ""debate_score"": 6484, ""sim"": 0.7863281868407102, ""decided_by"": ""tfidf_gate""}]",,Økonomi,1.4912502563605772,,,,,,html-enriched,Kyiv Independent (EN),https://kyivindependent.com/,"The facility lies about 1,400 kilometers (870 miles) from Ukraine-controlled territory.","One of Russia's largest refineries in southern Urals hit by Ukrainian drones, SBU source confirms",False
kyivindependent com drones-hit-major-oil-refinery-in-russias-leningrad-region,Mest debattert,"Ukraine confirms drone strike on one of Russia's biggest, most modern oil refineries near St. Petersburg. Drones struck the Kirishi oil refinery in Russia's Leningrad oblast overnight on Oct. 4, sparking a fire that was later extinguished, officials and local media reported.. kyivindependent com drones-hit-major-oil-refinery-in-russias-leningrad-region",UA,,,,False,"['petersburg', 'refineries', 'st', 'confirms', 'modern', 'biggest']",en,0.9999999878960676,en,agree,https://kyivindependent.com/drones-hit-major-oil-refinery-in-russias-leningrad-region/,9.352269363771356,9.352269363771356,2025-10-04T03:25:22+00:00,1,"[{""subreddit"": ""worldnews"", ""r_title"": ""Drones hit major oil refinery in Russia's Leningrad region"", ""permalink"": ""https://www.reddit.com/r/worldnews/comments/1nxk7sg/drones_hit_major_oil_refinery_in_russias/"", ""debate_score"": 5443, ""sim"": 0.6607971760222278, ""decided_by"": ""nano_forced""}]",Teknologi,Teknologi,1.8253924623964,,,,,,html-enriched,Kyiv Independent (EN),https://kyivindependent.com/,"Drones struck the Kirishi oil refinery in Russia's Leningrad oblast overnight on Oct. 4, sparking a fire that was later extinguished, officials and local media reported.","Ukraine confirms drone strike on one of Russia's biggest, most modern oil refineries near St. Petersburg",False
euronews com 2025 10 04 trump-urges-israel-to-stop-gaza-military-campaign-after-hamas-partially-accepts-his-peace-,Mest debattert,Trump urges Israel to stop bombing Gaza after Hamas partially accepts his peace plan | Euronews. “I believe they are ready for a lasting peace.” the US president wrote on social media after Hamas announced it was willing to release the hostages and hand over power to other Palestinians.. euronews com 2025 10 04 trump-urges-israel-to-stop-gaza-military-campaign-after-hamas-partially-accepts-his-peace-,EU,,,,True,"['bombing', 'partially', 'urges', 'accepts', 'stop', 'peace']",en,0.999999999999984,en,agree,https://www.euronews.com/2025/10/04/trump-urges-israel-to-stop-gaza-military-campaign-after-hamas-partially-accepts-his-peace-,9.108900612421644,9.108900612421644,2025-10-04T06:59:45+00:00,1,"[{""subreddit"": ""worldnews"", ""r_title"": ""Trump orders Israel to stop bombing Gaza after Hamas partially accepts his peace plan"", ""permalink"": ""https://www.reddit.com/r/worldnews/comments/1nxc917/trump_orders_israel_to_stop_bombing_gaza_after/"", ""debate_score"": 4267, ""sim"": 0.7423904862625619, ""decided_by"": ""tfidf_gate""}]",Politikk,Politikk,1.9932492809597409,,,,,,html-enriched,Euronews (EN),https://www.euronews.com/,“I believe they are ready for a lasting peace.” the US president wrote on social media after Hamas announced it was willing to release the hostages and hand over power to other Palestinians.,Trump urges Israel to stop bombing Gaza after Hamas partially accepts his peace plan | Euronews,True
euronews com 2025 10 03 poland-accuses-russia-of-attack-plot-involving-explosives-smuggled-in-corn-tins,Mest debattert,"Poland accuses Russia of attack plot involving explosives smuggled in corn tins | Euronews. Investigators haven't said what the motive for the planned attacks might be, but Poland's staunch support for Ukraine during the full-scale invasion could be a possible reason.. euronews com 2025 10 03 poland-accuses-russia-of-attack-plot-involving-explosives-smuggled-in-corn-tins",EU,,,,False,"['explosives', 'smuggled', 'tins', 'accuses', 'corn', 'plot']",en,0.9999999998919442,en,agree,https://www.euronews.com/2025/10/03/poland-accuses-russia-of-attack-plot-involving-explosives-smuggled-in-corn-tins,8.23268182815465,8.23268182815465,2025-10-03T18:22:57+00:00,1,"[{""subreddit"": ""worldnews"", ""r_title"": ""Poland accuses Russia of attack plot involving explosives smuggled in corn tins"", ""permalink"": ""https://www.reddit.com/r/worldnews/comments/1nxiozv/poland_accuses_russia_of_attack_plot_involving/"", ""debate_score"": 1776, ""sim"": 0.8631509862624498, ""decided_by"": ""tfidf_strict""}]",,Økonomi,1.745832899788884,,,,,,html-enriched,Euronews (EN),https://www.euronews.com/,"Investigators haven't said what the motive for the planned attacks might be, but Poland's staunch support for Ukraine during the full-scale invasion could be a possible reason.",Poland accuses Russia of attack plot involving explosives smuggled in corn tins | Euronews,False
irishexaminer com world arid-41717709 html,Mest debattert,"Sanae Takaichi set to become Japan’s first female prime minister. Japan’s governing party has elected former economic security minister Sanae Takaichi as its new leader, making her likely to become the country’s first female prime minister.. irishexaminer com world arid-41717709 html",IE,,,,False,"['sanae', 'takaichi', 'female', 'japan', 'become', 'prime']",en,0.9999999995074328,en,agree,https://www.irishexaminer.com//world/arid-41717709.html,7.490519359606223,7.490519359606223,2025-10-04T07:42:00+01:00,1,"[{""subreddit"": ""worldnews"", ""r_title"": ""Japan ruling party picks new leader, likely to become country’s first female Prime Minister"", ""permalink"": ""https://www.reddit.com/r/worldnews/comments/1nxnx0e/japan_ruling_party_picks_new_leader_likely_to/"", ""debate_score"": 845, ""sim"": 0.6216110163552881, ""decided_by"": ""tfidf_gate""}]",Meninger,Meninger,1.6389413245656437,,,,,,html,Irish Examiner,https://www.irishexaminer.com/,"Japan’s governing party has elected former economic security minister Sanae Takaichi as its new leader, making her likely to become the country’s first female prime minister.",Sanae Takaichi set to become Japan’s first female prime minister,False
kyivindependent com russian-drone-attack-kills-13-000-pigs-in-kharkiv-oblast,Mest debattert,"Russian drone attack on farm kills 13,000 pigs in Kharkiv Oblast. A Russian drone strike on a pig farm in Kharkiv Oblast killed approximately 13,000 pigs on Oct. 3, Ukraine's State Emergency Service (SES) reported.. kyivindependent com russian-drone-attack-kills-13-000-pigs-in-kharkiv-oblast",UA,,,,False,"['pigs', 'kills', 'kharkiv', 'farm', 'oblast', '13']",en,0.999996145157191,en,agree,https://kyivindependent.com/russian-drone-attack-kills-13-000-pigs-in-kharkiv-oblast/,7.475033642166843,7.475033642166843,2025-10-03T21:19:24+00:00,1,"[{""subreddit"": ""europe"", ""r_title"": ""Russian drones slaughter 13,000 pigs in Kharkiv Oblast farm strikes"", ""permalink"": ""https://www.reddit.com/r/europe/comments/1nwu8w5/russian_drones_slaughter_13000_pigs_in_kharkiv/"", ""debate_score"": 832, ""sim"": 0.6194849628451656, ""decided_by"": ""nano_forced""}]",Teknologi,Teknologi,1.5953377609358348,,,,,,html-enriched,Kyiv Independent (EN),https://kyivindependent.com/,"A Russian drone strike on a pig farm in Kharkiv Oblast killed approximately 13,000 pigs on Oct. 3, Ukraine's State Emergency Service (SES) reported.","Russian drone attack on farm kills 13,000 pigs in Kharkiv Oblast",False
euronews com 2025 10 03 french-photojournalist-antoni-lallican-killed-by-a-drone-in-ukraines-eastern-donbas-region,Mest debattert,"French photojournalist Antoni Lallican killed by a Russian drone in Ukraine's eastern Donbas region | Euronews. French President Emmanuel Macron was quick to react to the announcement, praising and expressing his condolences to the late journalist in a post on X.. euronews com 2025 10 03 french-photojournalist-antoni-lallican-killed-by-a-drone-in-ukraines-eastern-donbas-region",EU,,,,False,"['antoni', 'donbas', 'lallican', 'photojournalist', 'eastern', 'region']",en,0.9999999999862874,en,agree,https://www.euronews.com/2025/10/03/french-photojournalist-antoni-lallican-killed-by-a-drone-in-ukraines-eastern-donbas-region,6.2553315359323625,6.2553315359323625,2025-10-03T20:09:07+00:00,1,"[{""subreddit"": ""europe"", ""r_title"": ""Ukraine: French photojournalist Antoni Lallican killed by a drone in Donbas"", ""permalink"": ""https://www.reddit.com/r/europe/comments/1nx453d/ukraine_french_photojournalist_antoni_lallican/"", ""debate_score"": 245, ""sim"": 0.7222732693250068, ""decided_by"": ""tfidf_gate""}]",Teknologi,Teknologi,1.6942660197179995,,,,,,html-enriched,Euronews (EN),https://www.euronews.com/,"French President Emmanuel Macron was quick to react to the announcement, praising and expressing his condolences to the late journalist in a post on X.",French photojournalist Antoni Lallican killed by a Russian drone in Ukraine's eastern Donbas region | Euronews,False
theguardian com sport 2025 oct 04 amanda-anisimova-surges-to-china-open-final-after-outclassing-coco-gauff,Mest debattert,"Amanda Anisimova surges to China Open final after outclassing Coco Gauff | Tennis | The Guardian. Amanda Anisimova continued a stellar season by reacing her second WTA 1000 final of the year, outclassing Coco Gauff, the defending champion, 6-1, 6-2. theguardian com sport 2025 oct 04 amanda-anisimova-surges-to-china-open-final-after-outclassing-coco-gauff",GB,,,,False,"['amanda', 'anisimova', 'coco', 'gauff', 'surges', 'tennis']",en,0.9999999905035908,en,agree,https://www.theguardian.com/sport/2025/oct/04/amanda-anisimova-surges-to-china-open-final-after-outclassing-coco-gauff,5.26085950651685,5.26085950651685,2025-10-04T09:37:29+00:00,1,"[{""subreddit"": ""sports"", ""r_title"": ""Coco Gauff and Amanda Anisimova set up all-American semifinal at China Open"", ""permalink"": ""https://www.reddit.com/r/sports/comments/1nw5t6n/coco_gauff_and_amanda_anisimova_set_up/"", ""debate_score"": 90, ""sim"": 0.7012083772613893, ""decided_by"": ""tfidf_gate""}]",,Økonomi,2.1221213602116054,,,,,,html-enriched,The Guardian (UK),https://www.theguardian.com/uk,"Amanda Anisimova continued a stellar season by reacing her second WTA 1000 final of the year, outclassing Coco Gauff, the defending champion, 6-1, 6-2",Amanda Anisimova surges to China Open final after outclassing Coco Gauff | Tennis | The Guardian,False
luxtimes lu businessandfinance russia-drafts-plan-to-seize-assets-if-eu-acts-on-funds 94507775 html,Mest debattert,Russia drafts plan to seize assets if EU acts on funds. Kremlin calls European proposal to use Russian assets to support Ukraine ‘theft’. luxtimes lu businessandfinance russia-drafts-plan-to-seize-assets-if-eu-acts-on-funds 94507775 html,LU,,,,False,"['drafts', 'seize', 'acts', 'assets', 'funds', 'plan']",en,0.9999952704353924,en,agree,https://www.luxtimes.lu/businessandfinance/russia-drafts-plan-to-seize-assets-if-eu-acts-on-funds/94507775.html,4.969507705176107,4.969507705176107,2025-10-02T06:51:51.000Z,1,"[{""subreddit"": ""geopolitics"", ""r_title"": ""Russia Drafts Plan to Seize Assets If EU Acts on Funds"", ""permalink"": ""https://www.reddit.com/r/geopolitics/comments/1nvvvsg/russia_drafts_plan_to_seize_assets_if_eu_acts_on/"", ""debate_score"": 67, ""sim"": 0.9134178034171975, ""decided_by"": ""tfidf_strict""}]",,Økonomi,1.074253860681737,,,,,,html,Luxembourg Times (EN),https://www.luxtimes.lu/,Kremlin calls European proposal to use Russian assets to support Ukraine ‘theft’,Russia drafts plan to seize assets if EU acts on funds,False
apnews com video luxembourg-crowns-new-grand-duke-guillaume-after-his-father-abdicates-ap-explains-e9631d644d8c4e9db0fc4524cbfb032f,Mest debattert,"Luxembourg crowns new Grand Duke Guillaume after his father abdicates, AP explains. Grand Duke Guillaume swore an oath to ascend to the throne of Luxembourg on Friday following the abdication of his father.. apnews com video luxembourg-crowns-new-grand-duke-guillaume-after-his-father-abdicates-ap-explains-e9631d644d8c4e9db0fc4524cbfb032f",AT,,,,False,"['abdicates', 'ap', 'duke', 'guillaume', 'explains', 'father']",en,0.9999999989948656,en,agree,https://apnews.com/video/luxembourg-crowns-new-grand-duke-guillaume-after-his-father-abdicates-ap-explains-e9631d644d8c4e9db0fc4524cbfb032f,4.877134385045092,4.877134385045092,2025-10-04T01:17:31.442Z,1,"[{""subreddit"": ""worldnews"", ""r_title"": ""Luxembourg celebrates Grand Duke Guillaume after his father abdicates"", ""permalink"": ""https://www.reddit.com/r/worldnews/comments/1nxiuz5/luxembourg_celebrates_grand_duke_guillaume_after/"", ""debate_score"": 61, ""sim"": 0.8166128219440059, ""decided_by"": ""tfidf_strict""}]",,Økonomi,1.271831426792473,,,,,,sitemap,AP News – Austria hub,https://apnews.com/hub/austria,Grand Duke Guillaume swore an oath to ascend to the throne of Luxembourg on Friday following the abdication of his father.,"Luxembourg crowns new Grand Duke Guillaume after his father abdicates, AP explains",False
theguardian com world 2025 oct 04 palestine-action-protest-police-arrests-london-demo,Mest debattert,Palestine Action protest: police begin making arrests at London demo | Protest | The Guardian. Officers start arresting activists at silent vigil in support of banned organisation. theguardian com world 2025 oct 04 palestine-action-protest-police-arrests-london-demo,GB,,,,False,"['begin', 'demo', 'palestine', 'arrests', 'protest', 'protest']",en,0.9999949264440277,en,agree,https://www.theguardian.com/world/2025/oct/04/palestine-action-protest-police-arrests-london-demo,4.681825632724326,4.681825632724326,2025-10-04T12:08:17+00:00,1,"[{""subreddit"": ""ukpolitics"", ""r_title"": ""Palestine Action protest: police begin making arrests at London demo"", ""permalink"": ""https://www.reddit.com/r/ukpolitics/comments/1nxt2bh/palestine_action_protest_police_begin_making/"", ""debate_score"": 50, ""sim"": 0.8311822717043287, ""decided_by"": ""tfidf_strict""}]",,Økonomi,3.1610640551710145,,,,,,html-enriched,The Guardian (UK),https://www.theguardian.com/uk,Officers start arresting activists at silent vigil in support of banned organisation,Palestine Action protest: police begin making arrests at London demo | Protest | The Guardian,False
apnews com video jane-goodall-pioneering-conservationist-and-primatologist-dies-at-91-738c818c26d849c8a7440a960895800f,Mest debattert,"Jane Goodall, pioneering conservationist and primatologist, dies at 91. Jane Goodall, the conservationist renowned for her groundbreaking chimpanzee field research and globe-spanning environmental advocacy, has died. She was 91.. apnews com video jane-goodall-pioneering-conservationist-and-primatologist-dies-at-91-738c818c26d849c8a7440a960895800f",AT,,,,False,"['pioneering', 'conservationist', 'primatologist', '91', 'goodall', 'dies']",en,0.999999997446112,en,agree,https://apnews.com/video/jane-goodall-pioneering-conservationist-and-primatologist-dies-at-91-738c818c26d849c8a7440a960895800f,4.33351893845611,4.33351893845611,2025-10-01T20:59:31.614Z,1,"[{""subreddit"": ""environment"", ""r_title"": ""Jane Goodall, trailblazing primatologist and chimpanzee conservationist, has died"", ""permalink"": ""https://www.reddit.com/r/environment/comments/1nvgxop/jane_goodall_trailblazing_primatologist_and/"", ""debate_score"": 35, ""sim"": 0.6214198061090652, ""decided_by"": ""tfidf_gate""}]",,Økonomi,1.1586099560343928,,,,,,sitemap,AP News – Austria hub,https://apnews.com/hub/austria,"Jane Goodall, the conservationist renowned for her groundbreaking chimpanzee field research and globe-spanning environmental advocacy, has died. She was 91.","Jane Goodall, pioneering conservationist and primatologist, dies at 91",False
theguardian com politics 2025 oct 04 greens-on-track-to-supplant-labour-as-favourite-party-in-london-says-zack-polanski,Mest debattert,"Greens ‘on track’ to supplant Labour as favourite party in London, says Zack Polanski | Green party | The Guardian. Exclusive: poll asked voters to rank parties on how favourably they felt about them, with strong support in capital and among younger voters. theguardian com politics 2025 oct 04 greens-on-track-to-supplant-labour-as-favourite-party-in-london-says-zack-polanski",GB,,,,False,"['supplant', 'greens', 'zack', 'polanski', 'favourite', 'labour']",en,0.999999999994111,en,agree,https://www.theguardian.com/politics/2025/oct/04/greens-on-track-to-supplant-labour-as-favourite-party-in-london-says-zack-polanski,3.522588722239781,3.522588722239781,2025-10-04T11:00:03+00:00,1,"[{""subreddit"": ""ukpolitics"", ""r_title"": ""Greens ‘on track’ to supplant Labour as favourite party in London, says Zack Polanski"", ""permalink"": ""https://www.reddit.com/r/ukpolitics/comments/1nxt40e/greens_on_track_to_supplant_labour_as_favourite/"", ""debate_score"": 15, ""sim"": 0.873617656482223, ""decided_by"": ""tfidf_strict""}]",,Økonomi,2.4274296786259897,,,,,,html-enriched,The Guardian (UK),https://www.theguardian.com/uk,"Exclusive: poll asked voters to rank parties on how favourably they felt about them, with strong support in capital and among younger voters","Greens ‘on track’ to supplant Labour as favourite party in London, says Zack Polanski | Green party | The Guardian",False
