_link_txt,category,combined_text,country,curation_before_similarity,dedupe_reason,duplicate_of,is_trump_story,key_toks_title,lang,lang_conf,lang_detected,lang_method,link,most_debated_score,most_debated_score_raw,published_iso,reddit_match_count,reddit_matches,secondary_category,secondary_category_hint,shortlist_score,sim_cluster_id,sim_is_dupe,sim_score,sim_title_ratio,sim_to_index,source_method,source_name,source_url,summary,title,trump_exempt
,Politikk,,SE,-466.5433155577397,,,,,sv,0.9999999999999968,sv,agree,https://omni.se/buttigieg-min-sexualitet-var-en-karriardodare/a/GyolGl,,,2025-10-04T07:00:10+00:00,,,,Økonomi,1.8898514233243,606,False,,,,html-enriched,Omni (SE),https://omni.se/,"Den demokratiske politikern och tidigare transportministern Pete Buttigieg slår tillbaka mot tidigare Fox News-ankaret Tucker Carlson, som anklagar Buttigieg för att fejka sin homosexualitet för att vinna liberala röster.",Buttigieg: Trodde sexualiteten var en karriärdödare,
,Politikk,,MC,-539.0136528551321,,,,,en,0.9999999999993108,en,agree,https://www.monaco-tribune.com/en/2025/10/2025-2026-judicial-year-increased-litigation-creation-of-a-reserve-rule-of-law/,,,2025-10-02T16:44:44+00:00,,,,Økonomi,1.6249088387410031,635,False,,,,html-enriched,Monaco Tribune (EN),https://www.monaco-tribune.com/en/,"On Wednesday 1st October, the new session of the Courts and Tribunals opened at the Palais de Justice, with Prince Albert II in attendance. The ceremony","2025-2026 judicial year: increased litigation, creation of a reserve, rule of law",
,Teknologi,,AD,-0.24,,,,,en,0.9999999995710604,en,agree,https://financialpost.com/pmn/business-wire-news-releases-pmn/andorran-financial-authority-afa-modernizes-supervisory-infrastructure-with-regnologys-rsh-cloud-native-technology,,,2025-10-02T08:03:58+0000,,,Utenriks,Utenriks,1.447584018491176,14,False,,,,html,Andorra Daily News,https://andorradailynews.com/,"FRANKFURT, Germany — Regnology, a global leading software provider of regulatory reporting and supervisory technology solutions, is proud to announce that the Ando…",Andorran Financial Authority (AFA) Modernizes Supervisory Infrastructure with Regnology's RSH Cloud-Native Technology,
,Teknologi,,NL,-1.6467166200173746,,,,,en,1.0,en,agree,https://www.dutchnews.nl/2025/10/brainport-eindhoven-short-of-space-homes-and-workers-report/,,,2025-10-01T13:02:14+00:00,,,Vitenskap,Vitenskap,2.202684345525252,23,False,,,,html-enriched,DutchNews.nl,https://www.dutchnews.nl/,"The technology and innovation region Brainport Eindhoven will generate another 115,000 jobs over the next 25 years, but a shortage of housing and workers may scupper development, new research has shown. Estimates spanning the next 15 years already predicted 70,000 new jobs, including 20,000 at chipmaker ASML from 2028. An updated but as yet unpublished long-term infrastructure study by regional officials and seen by the AD has concluded that the region is likely to spawn a total of 115,000 more...","Brainport Eindhoven short of space, homes and workers: report - DutchNews.nl",
,Teknologi,,EU,-3.610875633210796,,,,,en,0.9999999995560076,en,agree,https://www.euronews.com/travel/2025/10/03/all-aboard-high-speed-train-links-for-travel-to-major-european-cities-gets-under-way,,,2025-10-03T10:43:51+00:00,,,Vitenskap,Vitenskap,1.6428313204551102,31,False,,,,html-enriched,Euronews (EN),https://www.euronews.com/,The High Speed Rail Network is expected to be completed in 20 years and a European study estimates the cost of implementation will be €546 billion.,All aboard: High-speed train links for travel to major European cities gets under way | Euronews,
,Teknologi,,DE,-5.377149699531195,,,,,en,0.9999999999999968,en,agree,https://www.spiegel.de/international/business/know-how-and-expertise-european-companies-hoping-to-take-the-global-lead-in-industrial-ai-a-90806d20-4391-4436-bfb8-45c7a6563228,,,2025-08-12T09:49:00+00:00,,,Utenriks,Utenriks,1.821568057357905,39,False,,,,html-enriched,Der Spiegel – International,https://www.spiegel.de/international/,"The U.S and China are far ahead when it comes to artificial intelligence. But industrial leaders in Europe, and especially in Germany, are hoping to find their footing with AI tools aimed specifically at making production facilities more efficient.",Know-How and Expertise: European Companies Hoping to Take the Global Lead in Industrial AI - DER SPIEGEL,
,Teknologi,,AT,-11.652147303235235,,,,,en,0.9999999988033216,en,agree,https://www.vindobona.org/news,,,,,,Utenriks,Utenriks,1.00375,66,False,,,,html-enriched,Vindobona – Austria’s News (EN),https://www.vindobona.org/,"Vindobona is a trusted and indispensable source of news and analysis for the powerful network of the international community of Vienna, Austria.",Latest News - Vindobona.org | Vienna International News,
,Teknologi,,UA,-23.094423094100247,,,,,en,1.0,en,agree,https://kyivindependent.com/munich-airport-again-halts-operations-due-to-drones-police-investigating-sightings-at-prague-airport/,,,2025-10-03T23:26:42+00:00,,,Utenriks,Utenriks,1.9170586347937528,108,False,,,,html-enriched,Kyiv Independent (EN),https://kyivindependent.com/,Authorities at Munich International Airport ordered a suspension in flight operations shortly after 9:30 p.m. local time after multiple drones were spotted in the vicinity of the airport for the second time in less than 24 hours.,Munich airport again halts operations due to drones; police investigating drones near Prague airport,
,Teknologi,,EU,-34.05626051992885,,,,,en,0.9999999998961668,en,agree,https://voxeurop.eu/en/guest_author/fabian-sommavilla/,,,,,,Utenriks,Utenriks,1.36875,139,False,,,,html-enriched,Voxeurop,https://voxeurop.eu/en/,"Fabian Sommavilla is an Austrian journalist and author. He wrote a book on the craziest borders of the world and covers international relations, nuclear weapons, arms control ""and futuristic stuff such as AI"" at Der Standard.",Fabian Sommavilla,
,Teknologi,,SE,-37.34942357943851,,,,,sv,0.9999999999905776,sv,agree,https://www.dn.se/motor/coupen-som-visar-mercedes-framtid/,,,2025-10-04T11:07:48.159+02:00,,,,Økonomi,1.418158064445078,148,False,,,,sitemap,Dagens Nyheter (SE),https://www.dn.se/,Mercedes CLA håller formen men bygger på en ny plattform som ger elbilen lång räckvidd och snabb laddning tack vare 800-voltsteknik.,Provkörning: Mercedes CLA 250+ with EQ technology,
,Teknologi,,FR,-40.16535470705195,,,,,en,1.0,da,langid_confident,https://www.lemonde.fr/international/article/2025/10/04/a-madagascar-le-president-andry-rajoelina-incrimine-les-robots-et-les-forces-des-tenebres-pour-expliquer-la-colere-de-la-generation-z_6644393_3210.html,,,2025-10-04T10:30:09+02:00,,,,Økonomi,1.8336102203093536,155,False,,,,sitemap,Le Monde (EN),https://www.lemonde.fr/en/,"Alors que les manifestations contre la vie chère et les coupures d’eau et d’électricité sont d’une ampleur inédite, le président malgache a attribué la colère de la jeunesse, vendredi, à une « manipulation de masse » orchestrée depuis l’étranger.","A Madagascar, le président, Andry Rajoelina, incrimine « les robots et les forces des ténèbres » pour expliquer la colère de la génération Z",
,Teknologi,,LU,-80.3518000801241,,,,,en,0.999999993747651,en,agree,https://www.luxtimes.lu/luxembourg/monarchy-memes-how-the-internet-marked-luxembourg-s-change-of-throne/95076905.html,,,2025-10-04T08:48:27.000Z,,,,Økonomi,1.645905328925675,251,False,,,,html,Luxembourg Times (EN),https://www.luxtimes.lu/,"A look at the top online memes posted during enthronement day, the first to be held in the social media era",Monarchy memes: how the internet marked Luxembourg’s change of throne,
,Teknologi,,GR,-83.33505687441453,,,,,en,0.9999999981755098,en,agree,https://www.ekathimerini.com/news/1237143/racist-violence-surges-in-greece-report-finds/,,,2024-04-23T00:00:00+00:00,,,,Økonomi,1.6089073653240409,255,False,,,,html-enriched,Kathimerini English Edition,https://www.ekathimerini.com/,"Attacks against migrants, refugees and LGBT people in Greece surged to their highest level in nearly a decade last year, a report by the Athens-based Racist Violence Recording Network (RVRN) has found.","Racist violence surges in Greece, report finds | eKathimerini.com",
,Teknologi,,IE,-93.37365638624966,,,,,en,0.999999999887846,en,agree,https://www.irishexaminer.com//world/arid-41717757.html,,,2025-10-04T12:07:00+01:00,,,,Økonomi,2.1869063242557667,273,False,,,,html,Irish Examiner,https://www.irishexaminer.com/,Munich Airport reopened on Saturday after German authorities shut it down the night before for the second time in less than 24 hours after more suspected drone sightings.,Munich Airport open again after drone-enforced closure,
,Teknologi,,CZ,-100.82421339275508,,,,,en,0.9999999980367882,en,agree,https://praguemonitor.com/news/27/10/2023/after-a-rocket-strike-in-egypt-500-czech-tourists-are-now-being-evacuated/,,,2023-10-27T13:53:03+00:00,,,,Økonomi,1.5901177066318832,288,False,,,,html-enriched,Prague Monitor (EN),https://praguemonitor.com/,"Chedok, a travel agency, is taking swift action to ensure the safety of approximately 500 Czech tourists in the Egyptian resort of Taba on the Red Sea. This","After A Rocket Strike In Egypt, 500 Czech Tourists Are Now Being Evacuated - Prague Monitor",
,Teknologi,,PL,-114.9325643599666,,,,,en,0.9999999996914508,en,agree,"https://www.polskieradio.pl/395/9766/artykul/3587850,electricity-restored-to-chernobyl-plant-after-russian-drone-attacks",,,,,,,Økonomi,1.595,312,False,,,,html-enriched,Polskie Radio – English,"https://www.polskieradio.pl/395,english-section","Electricity has been fully restored to the Chernobyl Nuclear Power Plant after a temporary outage caused by Russian drone attacks, Ukrainian authorities said.",Electricity restored to Chernobyl plant after Russian drone attacks - English Section,
,Teknologi,,EE,-176.3770032819627,,,,,en,0.9999999989032295,en,agree,https://estonianworld.com/business/estonian-ai-fintech-startup-creem-raises-e1-8-million/,,,2025-09-23T01:45:00+00:00,,,,Økonomi,1.3210087320404544,404,False,,,,html-enriched,Estonian World (EN),https://estonianworld.com/,"Estonian AI fintech Creem raises €1.8M pre-seed led by Practica Capital, with Antler and angel investors joining.",Estonian AI fintech startup Creem raises €1.8 million,
,Teknologi,,GB,-198.05018226437605,,,,,en,0.9999999996749074,en,agree,https://www.theguardian.com/business/2025/oct/04/delivery-robots-skype-co-founder-ahti-heinla-starship,,,2025-10-04T11:00:04+00:00,,,,Økonomi,2.360036621114207,430,False,,,,html-enriched,The Guardian (UK),https://www.theguardian.com/uk,"Ahti Heinla on bringing his tech to small towns, its effects on jobs – and whether he’s still interested in money",‘Delivery robots will happen’: Skype co-founder on his fast-growing venture Starship | Retail industry | The Guardian,
,USA,,UA,0.15,,,,,en,1.0,en,agree,https://kyivindependent.com/ukraine-war-latest-122/,,,2025-10-03T19:20:42+00:00,,,Teknologi,Politikk,2.3115124540580987,10,False,,,,html-enriched,Kyiv Independent (EN),https://kyivindependent.com/,"Key developments on Oct. 3: * Russia targets Ukraine's energy infrastructure in massive strikes ahead of winter, Zelensky says * Ukrainian drones strike major Russian chemical plant over 1,700 kilometers from front lines * Trump unlikely to send Tomahawk long-range missiles to Ukraine, Reuters reports * One of Russia's largest refineries in southern Urals hit by Ukrainian drones, SBU source confirms * Germany shuts down Munich Airport due to drone sightings as Bavaria pushes for tougher re","Ukraine war latest: Russia targets Ukraine's energy infrastructure in massive strikes ahead of winter, Zelensky says",
,USA,,DK,-2.9208756332107964,,,,,da,0.9999999999998056,da,agree,https://nyheder.tv2.dk/live/udland/2025-09-19-usas-statsapparat-er-delvist-lukket-ned,,,2025-09-19T18:55:58.999000+00:00,,,Underholdning,Underholdning,1.406894182412083,28,False,,,,html-enriched,TV 2 Nyheder (DA),https://nyheder.tv2.dk/,Hvad sker der? Senatet er fredag aften dansk tid ikke nÃ¥et til enighed om et midlertidigt finaniseringsforslag. Det amerikanske statsapparat er delvist nedlukk...,USA's statsapparat er delvist lukket ned - TV 2,
,USA,,AT,-18.593375412685464,,,,,en,0.9999999999999925,en,agree,https://apnews.com/video/all-the-walls-came-down-for-ondi-timoner-and-neighbors-in-altadena-ap-interview-00000199a85dd8dba1dbf95d8d9e0000,,,2025-10-03T04:39:50.295Z,,,Underholdning,Underholdning,1.406319136683249,90,False,,,,sitemap,AP News – Austria hub,https://apnews.com/hub/austria,"Ondi Timoner was in Europe working on a movie when the Eaton Fire burned through the Southern California community of Altadena in January, destroying her home and more than 5,000 others and killing more than 19 people.",'All The Walls Came Down' for Ondi Timoner and neighbors in Altadena | AP interview,
,USA,,FI,-38.419973111198125,,,,,en,1.0,en,agree,https://www.helsinkitimes.fi/world-int/28056-trump-and-hegseth-tell-generals-us-faces-enemy-within-at-quantico-summit.html,,,2025-09-30T15:10:14+00:00,,,Politikk,Politikk,2.2212518036874216,151,False,,,,html-enriched,Helsinki Times (EN),https://www.helsinkitimes.fi/,"US President Donald Trump and Defence Secretary Pete Hegseth addressed hundreds of senior officers on Tuesday in a highly unusual gathering at Marine Corps Base Quantico in Virginia. More than 800 generals, admirals and their top advisers were ordered to attend with only days’ notice. Analysts described the scale and urgency of the meeting as unprecedented. Trump spoke for more than an hour, mixing domestic policy with military priorities. He told commanders that they would play a role in quelling un...",Trump and Hegseth tell generals US faces ‘enemy within’ at Quantico summit - Helsinki Times,
,USA,,LU,-72.98755687441452,,,,,en,0.9999980415581546,en,agree,https://www.luxtimes.lu/businessandfinance/difficult-choices-for-eu-digital-regulation-push-amid-us-pressure/88547941.html,,,2025-09-05T15:48:11.000Z,,,Politikk,Politikk,1.259134017104112,234,False,,,,html,Luxembourg Times (EN),https://www.luxtimes.lu/,"Recent developments should lead bloc to strengthen its autonomy, writes University of Luxembourg postdoctoral researcher Mark Konstantinidis",Difficult choices for EU digital regulation push amid US pressure,
,USA,,EU,-91.22544304542816,,,,,en,0.999997619033483,en,agree,https://www.politico.eu/article/european-research-council-funding-us-researchers-relocation-europe/,,,2025-09-29T16:13:07Z,,,Vitenskap,Vitenskap,1.0058350212538496,272,False,,,,html,Politico Europe,https://www.politico.eu/,U.S.-based applicants to a prestigious EU research scheme have increased five-fold.,Top US researchers rush to relocate to Europe,
,USA,,IE,-117.93956788827498,,,,,en,0.999999999984319,en,agree,https://www.independent.ie/irish-news/presidential-election/votesmart-from-trump-to-migration-where-do-the-presidential-candidates-stand/a657806020.html,,,2025-10-03T10:36:00+02:00,,,Politikk,Politikk,1.3197344771426307,317,False,,,,sitemap,Irish Independent,https://www.independent.ie/,VoteSmart gave each presidential election candidate the opportunity to provide a rationale or motivation for their position on different issues so they could add nuance if desired.,VoteSmart: From Trump to migration – where do the presidential candidates stand?,
,USA,,ES,-134.91881373325452,,,,,en,1.0,en,agree,https://english.elpais.com/culture/2025-10-04/alison-bechdel-cartoonist-weve-gotten-so-polarized-in-the-united-states-that-were-unable-to-see-each-others-humanity.html,,,2025-10-04T04:00:00+00:00,,,Kultur,Kultur,1.858012233068025,343,False,,,,html-enriched,EL PAÍS (EN),https://english.elpais.com/,The author of ‘Fun Home’ has published a satire in which a group of Boomers confronts the traps of capitalism and the contradictions of always being on the side of the good guys,"Alison Bechdel, cartoonist: ‘We’ve gotten so polarized in the United States that we’re unable to see each other’s humanity’ | Culture | EL PAÍS English",
,USA,,CZ,-160.4900319446714,,,,,en,0.999997952709725,en,agree,https://praguemonitor.com/czechia/10/11/2023/instagram-launched-paid-subscriptions-for-czech-users-for-240-czk/,,,2023-11-10T19:24:44+00:00,,,Teknologi,Teknologi,1.5901201210724742,381,False,,,,html-enriched,Prague Monitor (EN),https://praguemonitor.com/,"Meta Platforms, the American internet company, is gradually introducing Instagram and Facebook subscriptions across Europe. Starting this week, residents in",Instagram Launched Paid Subscriptions For Czech Users For 240 CZK - Prague Monitor,
,USA,,EE,-196.4551029928085,,,,,en,0.9999999268702068,en,agree,https://news.err.ee/1609819758/president-takes-controversial-church-law-amendments-to-supreme-court,,,2025-10-03T16:18:00+0300,,,Politikk,Politikk,1.3709020883884668,427,False,,,,html,ERR News (EN),https://news.err.ee/,"President Alar Karis sent the amendment to the Churches and Congregations Act to the Supreme Court, seeking to have it declared unconstitutional.",President takes controversial church law amendments to Supreme Court,
,USA,,SE,-251.71658574188064,,,,,sv,1.0,sv,agree,https://omni.se/anhoriga-till-gisslan-hyllar-framsteg-i-forhandlingarna/a/0VMERG,,,2025-10-04T11:42:30+00:00,,,,Økonomi,2.942361587685213,480,False,,,,html-enriched,Omni (SE),https://omni.se/,"Familjemedlemmar till de gisslantagna i Gaza hyllar Donald Trump och hans 20-punktsplan, rapporterar israeliska medier. Enligt planen, som både Israel och Hamas i det här skedet har sagt ja till, ska alla i gisslan släppas.",Förnyat hopp om fred i både Israel och Gaza: ”Närmare än någonsin”,
,USA,,,-260.3394637449281,,,,,,0.9999999999995112,no,agree,https://www.nrk.no/urix/hamas-sier-de-er-klare-til-a-frigi-alle-gislene-1.17597205,,,2025-10-03T16:23:28+02:00,,,,Økonomi,1.1386278268798122,488,False,,,,sitemap,NRK – Toppsaker,https://www.nrk.no/,"Hamas går med på deler av Trump sin fredsplan. – Gjør det mulig å avslutte hele krigen i Gaza, sier Midtøsten-ekspert.",Trump ser positivt på Hamas sitt svar: – Jeg tror de ønsker en varig fred,
,USA,,PL,-295.50686568618687,,,,,en,1.0,en,agree,https://notesfrompoland.com/donations/support-us-2/,,,,,,Økonomi,Økonomi,1.8875,513,False,,,,html-enriched,Notes from Poland,https://notesfrompoland.com/,"Notes from Polandis run by a small editorial team and published by an independent, non-profit foundation that is funded through donations from our readers. We can’t do what we do without your support. Every donation helps us to create new content – from breaking news stories to deeper insight pieces. By supporting our work, you’ll be part of our mission to bring the full picture on Poland to the world. Thank you!",Support us | Notes From Poland,
,USA,,DE,-322.322446552427,,,,,en,0.9999999995496276,en,agree,https://www.spiegel.de/international/business/dark-clouds-for-the-economy-trumps-attacks-on-the-fed-could-signal-a-maga-takeover-a-0073d56f-d7fd-4162-beec-a0d7f2bff04f,,,2025-08-19T16:08:00+00:00,,,Økonomi,Økonomi,1.6243162881222104,529,False,,,,html-enriched,Der Spiegel – International,https://www.spiegel.de/international/,Donald Trump's continued attacks on Federal Reserve chief Jerome Powell threaten the pillars of the U.S. economy. He could be planning a complete MAGA takeover of monetary policy.,Donald Trump's Attacks on the Fed Could Signal a MAGA Takeover - DER SPIEGEL,
,USA,,GR,-331.8360155927222,,,,,en,0.9999999972790704,en,agree,https://www.ekathimerini.com/culture/1282811/greece-welcomes-return-of-29-antiquities-from-new-york/,,,2025-10-03T00:00:00+00:00,,,,Økonomi,1.5623977534146256,535,False,,,,html-enriched,Kathimerini English Edition,https://www.ekathimerini.com/,Twenty-nine antiquities have been formally handed over to the Greek authorities in a ceremony at the Consulate General of Greece in New York.,Greece welcomes return of 29 antiquities from New York | eKathimerini.com,
,USA,,GB,-493.2771054638561,,,,,en,0.999999995575534,en,agree,https://www.theguardian.com/us-news/2025/oct/04/maga-white-house-press-corps-trump-administration,,,2025-10-04T10:00:04+00:00,,,,Økonomi,2.1274221162638987,616,False,,,,html-enriched,The Guardian (UK),https://www.theguardian.com/uk,Trump administration has transformed tone and tenor of media interactions by centering rightwing voices and reporter sycophancy,How Maga cheerleaders have infiltrated the White House press corps | Trump administration | The Guardian,
,Underholdning,,NL,1.0,,,,,en,1.0,en,agree,https://www.dutchnews.nl/2025/09/ongoing-new-show-at-the-eye-focuses-on-actress-tilda-swinton/,,,2025-09-29T14:03:04+00:00,,,Kultur,Kultur,2.2105244277215563,4,False,,,,html-enriched,DutchNews.nl,https://www.dutchnews.nl/,"British actress Tilda Swinton has regaled audiences around the world on stage, screen, and via other mediums for over 40 years. Now her life and career are the subject of “Ongoing”, a new exhibition that debuted at Amsterdam’s Eye Film Museum on Monday. Those looking for more than a few passing references to her Hollywood blockbusters are bound to go home disappointed, though. “Ongoing” runs now through February 8 2026 and it isn’t the sort of show that features costumes...",‘Ongoing’ - new show at the Eye focuses on actress Tilda Swinton - DutchNews.nl,
,Underholdning,,GR,-0.1225,,,,,en,1.0,en,agree,https://www.ekathimerini.com/nytimes/1282644/jane-goodall-eminent-primatologist-who-chronicled-the-lives-of-chimps-dies-at-91/,,,2025-10-03T00:00:00+00:00,,,Utenriks,Utenriks,2.0811477536180902,13,False,,,,html-enriched,Kathimerini English Edition,https://www.ekathimerini.com/,"Jane Goodall, one of the world’s most revered conservationists, who earned scientific stature and global celebrity by chronicling the distinctive behavior of wild chimpanzees in East Africa — primates that made and used tools, ate meat, held rain dances and engaged in organized warfare — died Wednesday in Los Angeles. She was 91.","Jane Goodall, eminent primatologist who chronicled the lives of chimps, dies at 91 | eKathimerini.com",
,Underholdning,,,-6.52746223759786,,,,,,0.9999995395148598,no,agree,https://www.nrk.no/viten/,,,2013-07-01T08:09:28+00:00,,,Vitenskap,Vitenskap,0.800018608611346,45,False,,,,html-enriched,NRK – Viten,https://www.nrk.no/viten/,Nyheter og TV om forskning og ny vitenskap. Se og diskuter NRKs forskningsstoff.,NRK Viten – Nyheter innen vitenskap og forskning,
,Underholdning,,DE,-14.9764788032894,,,,,en,0.9999999999962405,en,agree,https://www.tagesspiegel.de/kultur/film-review-union-furs-leben-5161669.html,,,2014-04-01T12:56:00.000Z,,,Kultur,Kultur,1.397519822323224,80,False,,,,html,Tagesspiegel – In English,https://www.tagesspiegel.de/kultur/themen/in-english,"Last weekend saw the eleventh 11mm Football Film Festival take place in Berlin. The headline piece this year was a documentary about East Berlin, personal struggles and 1. FC Union. A review by Andrew Cherrie.","11mm Football Film Festival: Film Review: ""Union fürs Leben""",
,Underholdning,,ES,-19.428375412685465,,,,,en,1.0,en,agree,https://english.elpais.com/culture/2025-09-26/a-true-crime-an-empathetic-kidnapper-and-al-pacino-how-dog-day-afternoon-made-history.html,,,2025-09-26T14:21:19+00:00,,,Kultur,Kultur,1.720475320934109,95,False,,,,html-enriched,EL PAÍS (EN),https://english.elpais.com/,"Fifty years after its premiere, it is still remembered as a brave, intelligent and emotional film, one of the pearls of New Hollywood and a highlight in the career of one of the big screen’s biggest stars","A true crime, an empathetic kidnapper and Al Pacino: How ‘Dog Day Afternoon’ made history | Culture | EL PAÍS English",
,Underholdning,,,-21.941923094100247,,,,,,0.9999999999994602,no,agree,https://www.nrk.no/kultur/_-en-perfekt-utfort-selvbiografi-1.17596683,,,2025-10-03T10:30:50+00:00,,,Kultur,Kultur,1.5372207562260736,104,False,,,,html-enriched,NRK – Kultur,https://www.nrk.no/kultur/,"Jeg blir ordentlig glad når en komiker tar materialet sitt så på alvor at strukturen får skinne på denne måten, mener vår humorkritiker Espen Borge.",– En perfekt utført selvbiografi – NRK Kultur og underholdning,
,Underholdning,,DK,-32.481260519928846,,,,,da,0.999999999999553,da,agree,https://politiken.dk/kultur/medier/art10573013/Der-lugter-igen-af-indspisthed-i-JPPolitikens-Hus,,,2025-10-04T07:37:50+00:00,,,Teknologi,Teknologi,1.754003719815627,133,False,,,,html-enriched,Politiken – Seneste nyt (DA),https://politiken.dk/,"Medier | Følg med i Politikens dækning af medier og mediebranchen. Fra de store morgenaviser, radio og tv til the dark web, ai og de nyeste sociale medier.",Der lugter igen af indspisthed i JP/Politikens Hus,
,Underholdning,,SE,-44.29684078347372,,,,,sv,1.0,sv,agree,https://omni.se/uppfann-selfien-nu-ska-paris-hilton-slappa-taget/a/B0AJ49,,,2025-10-04T10:09:57+00:00,,,,Økonomi,2.267182331241651,167,False,,,,html-enriched,Omni (SE),https://omni.se/,"Paris Hilton, tidigare världskänd som ”dum blondin” i tv-serien The Simple Life och påstådd uppfinnare av den moderna selfien, är trött på fördomarna och vill förnya sig själv genom ett nytt kliv i karriären, säger hon till spanska El País.",Uppfann selfien – nu ska Paris Hilton ”släppa taget”,
,Underholdning,,IE,-47.039643039509095,,,,,en,0.9999999946366472,en,agree,https://www.irishexaminer.com//news/spotlight/arid-41717106.html,,,2025-10-04T01:30:00+01:00,,,Utenriks,Utenriks,1.4764918628810646,175,False,,,,html,Irish Examiner,https://www.irishexaminer.com/,"From early call times to curlers and camaraderie, Cork’s film extras reveal the fun, reality and dreams behind Hollywood glamour",Inside the world of film extras in West Cork: The locals starring in Hollywood movie Jimmy,
